180	Investment	Guaranteed investment contract	99	A guaranteed investment contract (GIC) is a contract that guarantees repayment of principal and a fixed or floating interest rate for a predetermined period of time. Guaranteed investment contracts are typically issued by life insurance companies qualified for favorable tax status under the Internal Revenue Code. A GIC is used primarily as a vehicle that yields a higher return than a savings account or United States Treasury securities and GICs are often used as investments for stable value funds. GICs are sometimes referred to as funding agreements, although this term is often reserved for contracts sold to non-qualified institutions.
181	Investment	Growth investing	62	Growth investing is a style of investment strategy focused on capital appreciation. Those who follow this style, known as growth investors, invest in companies that exhibit signs of above-average growth, even if the share price appears expensive in terms of metrics such as price-to-earnings or price-to-book ratios. In typical usage, the term "growth investing" contrasts with the strategy known as value investing.
182	Investment	Greater fool theory	85	In finance and economics, the greater fool theory states that the price of an object is determined not by its intrinsic value, but rather by irrational beliefs and expectations of market participants. A price can be justified by a rational buyer under the belief that another party is willing to pay an even higher price. In other words, one may pay a price that seems "foolishly" high because one may rationally have the expectation that the item can be resold to a "greater fool" later.
183	Investment	Good 'til cancelled	32	In investment, a good ’til cancelled (GTC) order is an order to buy or sell a security at a specified price which remains in effect until executed or cancelled by the investor.
184	Investment	Goal-based investing	78	Goal Based Investing or Goal Driven Investing is an investment methodology where performance is measured by the success of investments in meeting an individual's personal and lifestyle goals. This differs from conventional investing methodologies, where financial performance is defined as a return against an investment benchmark. This approach results in focus of the investment approach shifting from achieving a higher returns approach to the investment, or exceeding the market returns approach to funding a personal financial goals approach.
185	Investment	Gender lens investing	46	Gender lens investing is the practice of investing for financial return while also considering the benefits to women, both through improving economic opportunities and social well being for girls and women. The term was coined around 2009 and became an increasingly popular practice in the mid-2010s.
186	Investment	G33 (developing countries)	33	The G33 is a coalition of developing countries, established prior to the 2003 Cancun ministerial conference, that have coordinated during the Doha Round of World Trade Organization negotiations, specifically in regard to agriculture.
187	Investment	G20 developing nations	62	The G20 developing nations is a bloc of developing nations established on 20 August 2003. Distinct and separate from the G20 major economies, the group emerged at the 5th Ministerial WTO conference, held in Cancún, Mexico, from 10 September to 14 September 2003. The group accounted for 60% of the world's population, 70% of its farmers and 26% of world’s agricultural exports.
188	Investment	Frontier markets	112	A frontier market is a type of developing country which is more developed than the least developing countries, but too small, risky, or illiquid to be generally considered an emerging market. The term is an economic term which was coined by International Finance Corporation’s Farida Khambata in 1992. The term is commonly used to describe the equity markets of the smaller and less accessible, but still "investable", countries of the developing world. The frontier, or pre-emerging equity markets are typically pursued by investors seeking high, long-run return potential as well as low correlations with other markets. Some frontier market countries were emerging markets in the past, but have regressed to frontier status.
189	Investment	Foreign portfolio investment	63	A foreign portfolio investment is a grouping of assets such as stocks, bonds, and cash equivalents. Portfolio investments are held directly by an investor or managed by financial professionals. In economics, foreign portfolio investment is the entry of funds into a country where foreigners deposit money in a country's bank or make purchases in the country’s stock and bond markets, sometimes for speculation.
190	Investment	Flipping	43	Flipping is a term used primarily in the United States to describe purchasing a revenue-generating asset and quickly reselling it for profit. Though flipping can apply to any asset, the term is most often applied to real estate and initial public offerings (IPOs).
191	Investment	Fixed-income relative-value investing	53	Fixed-Income Relative-Value Investing (FI-RV) is a hedge fund investment strategy made popular by the failed hedge fund Long-Term Capital Management. FI-RV Investors most commonly exploit interest-rate anomalies in the large, liquid markets of North America, Europe and the Pacific Rim. The financial instruments traded include government bonds, interest rate swaps and futures contracts.
192	Investment	FIRE movement	40	The FIRE movement is a lifestyle movement whose goal is financial independence and retiring early. The model became particularly popular among millennials in the 2010s, gaining traction through online communities via information shared in blogs, podcasts, and online discussion forums.
193	Investment	Financial sponsor	20	A financial sponsor is a private equity investment firm, particularly a private equity firm that engages in leveraged buyout transactions.
194	Investment	Financial planning (business)	60	Financial planning is the task of determining how a business will afford to achieve its strategic goals and objectives. Usually, a company creates a Financial Plan immediately after the vision and objectives have been set. The Financial Plan describes each of the activities, resources, equipment and materials that are needed to achieve these objectives, as well as the timeframes involved.
195	Investment	Fence (finance)	19	Fence is an investment strategy that uses options to limit the range of possible returns on a financial instrument.
196	Investment	Fed model	66	The "Fed model" is a theory of equity valuation that has found broad application in the investment community. The model compares the stock market’s earnings yield (E/P) to the yield on long-term government bonds. In its strongest form the Fed model states that bond and stock market are in equilibrium, and fairly valued, when the one-year forward-looking earnings yield equals the 10-year Treasury note yield :
197	Investment	Factor investing	58	Factor investing is an investment approach that involves targeting quantifiable firm characteristics or “factors” that can explain differences in stock returns. Over the last fifty years, academic research has identified hundreds of factors that impact stock returns. Security characteristics that may be included in a factor-based approach includes size, value, momentum, asset growth, profitability, leverage, term and carry.
198	Investment	Exempt market dealer	52	The Canadian Securities Administrators (“CSA’) have made the harmonization of the registration rules among the jurisdictions of Canada a key goal. Pursuant to this goal new national securities regulations have been drafted - NI 31-103 to provide uniform requirements and categories of registration for dealers in exempt market securities across the country.
199	Investment	Exchange fund	43	An exchange fund or swap fund is a mechanism specific to the U.S., first introduced in the late 1960s, that allows holders of a large amount of a single stock to diversify into a basket of other stocks without directly selling their stock.
200	Investment	Ex-ante	94	The term ex-ante is a phrase meaning "before the event". Ex-ante or notional demand refers to the desire for goods and services which is not backed by the ability to pay for those goods and services. This is also termed as ‘wants of people’. Ex-ante is used most commonly in the commercial world, where results of a particular action, or series of actions, are forecast in advance. The opposite of ex-ante is ex-post (actual). Buying a lottery ticket loses you money ex ante, but if you win, it was the right decision ex post.
201	Investment	European Commission Investment Plan for Europe	59	The European Commission’s Investment Plan for Europe known as the “Juncker Plan” or the “EU Infrastructure Investment Plan” is an ambitious infrastructure investment programme first announced by European Commission President Jean-Claude Juncker in November 2014: it aims at unlocking public and private investments in the “real economy” of at least € 315 billion over a three years fiscal period.
202	Investment	ESG Quant	83	ESG Quant is an investment strategy, developed by Arabesque Partners, which involves quantitative equity investing while utilizing ESG information, often referred to as "non-financial" information. ESG Quant strategies are implemented within systematic trading or quantitative trading approaches. As such there is no human judgment or discretionary buy-sell decision making; rather “in a pure quant model the final decision to buy or sell is made by the model” or through the “utilization of an expert system that replicates previously captured actions of real traders.”
203	Investment	Equity repositioning	57	Equity Repositioning is the financial strategy of taking an equity rich asset base and repositioning those assets into a diversity of investment vehicles. The idea is to borrow against the equity value of a property and reposition that capital. This strategy is aimed at earning a rate of return greater than the cost to borrow the funds.
204	Investment	Equator Principles	98	The Equator Principles is a risk management framework, adopted by financial institutions, for determining, assessing and managing environmental and social risk in project finance. It is primarily intended to provide a minimum standard for due diligence to support responsible risk decision-making. As at February 2019, 94 adopting financial institutions in 37 countries have officially adopted the Equator Principles, covering the majority of international Project Finance debt in emerging and developed markets. The Equator Principles, formally launched in Washington DC on 4 June 2003, were based on existing environmental and social policy frameworks established by the International Finance Corporation.
205	Investment	Enhanced indexing	29	In finance, enhanced indexing is any strategy employed to outperform traditional indexing. Enhanced indexing attempts to generate modest excess returns compared to index funds and other passive management techniques.
206	Investment	Engineering economics (civil engineering)	147	Engineering Economics in Civil Engineering, also known generally as engineering economics, or alternatively engineering economy, is a subset of economics, more specifically, microeconomics. It is defined as a "guide for the economic selection among technically feasible alternatives for the purpose of a rational allocation of scarce resources." Its goal is to guide entities, private or public, that are confronted with the fundamental problem of economics.This fundamental problem of economics consists of two fundamental questions that must be answered, namely what objectives should be investigated or explored and how should these be achieved? Economics as a social science answers those questions and is defined as the knowledge used for selecting among “…technically feasible alternatives for the purpose of a rational allocation of scarce resources.” Correspondingly, all problems involving "...profit maximizing or cost-minimizing are engineering problems with economic objectivesand are properly described by the label "engineering economy".
207	Investment	Employee stock purchase plan	93	In the United States, an employee stock purchase plan (ESPP) is a tax-efficient means by which employees of a corporation can purchase the corporation's stock, often at a discount. Employees contribute to the plan through payroll deductions, which build up between the offering date and the purchase date. At the purchase date, the company uses the accumulated funds to purchase shares in the company on behalf of the participating employees. The amount of the discount depends on the specific plan but can be as much as 15% lower than the market price.
208	Investment	Emerging market	123	An emerging market is a market that has some characteristics of a developed market, but does not fully meet its standards. This includes markets that may become developed markets in the future or were in the past. The term "frontier market" is used for developing countries with smaller, riskier, or more illiquid capital markets than "emerging". The economies of China and India are considered to be the largest emerging markets. According to The Economist, many people find the term outdated, but no new term has gained traction. Emerging market hedge fund capital reached a record new level in the first quarter of 2011 of $121 billion. The four largest emerging and developing economies by either nominal or PPP-adjusted GDP are the BRIC countries.
209	Investment	Eco-investing	42	Eco-investing or green investing, is a form of socially responsible investing where investments are made in companies that support or provide environmentally friendly products and practices. These companies encourage new technologies that support the transition from carbon dependence to more sustainable alternatives.
210	Investment	Earnings growth	43	Earnings growth is the annual compound annual growth rate (CAGR) of earnings from investments. For more general discussion see: Sustainable growth rate #From a financial perspective; Stock valuation #Growth rate; Valuation using discounted cash flows #Determine the continuing value; Growth stock; PEG ratio.
211	Investment	Double bottom line	106	Double bottom line seeks to extend the conventional bottom line, that measures fiscal performance—financial profit or loss—by adding a second bottom line to measure their performance in terms of positive social impact. There is controversy about how to measure the double bottom line, especially since the use of the term "bottom line" implies some form of quantification. A 2004 report by the Center for Responsible Business noted that while there are "generally accepted principles of accounting" for financial returns, "A comparable standard for social impact accounting does not yet exist." Social return on investment has been suggested as a way to quantify the second bottom line.
212	Investment	Domain Developers Fund	67	Domain Developers Fund (DDF) is the first public open-ended alternative investment fund exclusively invested in Internet domain names. DDF maintains an inventory of websites and domain names, including a wide variety of gTLD and ccTLD domains, from which it extracts advertising revenue through a combination of pay per click advertising, affiliate marketing and domain parking. Internet domains are perceived as an alternate asset class for investment diversification.
213	Investment	Dollar cost averaging	51	Dollar cost averaging (DCA) is an investment strategy that aims to reduce the impact of volatility on large purchases of financial assets such as equities. Dollar cost averaging is also called the constant dollar plan, pound-cost averaging, and, irrespective of currency, unit cost averaging, incremental trading, or the cost average effect.
214	Investment	Dogs of the Dow	86	The Dogs of the Dow is an investment strategy popularized by Michael B. O'Higgins in 1991 and the official Dogs of the Dow website, which proposes that an investor annually select for investment the ten Dow Jones Industrial Average (DJIA) stocks whose dividend is the highest fraction of their price. Under other analysis these stocks would be considered "dogs", or undesirable, but the Dogs of the Dow strategy proposes these same stocks have the potential for substantial increases in stock price plus relatively high dividend payouts.
215	Investment	Do-it-yourself investing	42	Do-it-yourself (DIY) investing, self-directed investing or self-managed investing is an investment approach where the investor chooses to build and manage his or her own investment portfolio instead of hiring an agent, such as a stockbroker, investment adviser, private banker, or financial planner.
216	Investment	Dividend policy	92	Dividend policy is concerned with financial policies regarding paying cash dividend in the present or paying an increased dividend at a later stage. Whether to issue dividends, and what amount, is determined mainly on the basis of the company's unappropriated profit and influenced by the company's long-term earning power. When cash surplus exists and is not needed by the firm, then management is expected to pay out some or all of those surplus earnings in the form of cash dividends or to repurchase the company's stock through a share buyback program.
217	Investment	Divestment	38	In finance and economics, divestment or divestiture is the reduction of some kind of asset for financial, ethical, or political objectives or sale of an existing business by a firm. A divestment is the opposite of an investment.
218	Investment	Displaced sales	63	In real estate investing, displaced sales are the opposite of leakage. Essentially, displaced sales are purchases made far out of a consumer's local economic area, even if that local economic area has comparable goods. Displaced sales are sales which come into a firm from outside. Leaked sales are sales which are not made inside a firm, even if that firm has comparable goods.
219	Investment	Disinvestment	85	Disinvestment refers to the use of a concerted economic boycott to pressure a government, industry, or company towards a change in policy, or in the case of governments, even regime change. The term was first used in the 1980s, most commonly in the United States, to refer to the use of a concerted economic boycott designed to pressure the government of South Africa into abolishing its policy of apartheid. The term has also been applied to actions targeting Iran, Sudan, Northern Ireland, Myanmar, and Israel.
220	Investment	Directed trust	100	A directed trust is an investment trust in which the trustee is directed by a number of other trust participants in implementing the trust's execution. That trustee is referred to as a Directed Trustee. Examples of other trust participants include a distribution committee, trust protector, or investment advisor. A directed trustee's role often includes: following distribution and investment instructions, holding legal title to the trust assets, providing fiduciary and tax accounting, coordinating trust participants and offering dispute resolution among those participants. Typically, these duties and the other participants in the trust are defined and governed by the trust document itself.
221	Investment	Developed market	50	In investing, a developed market is a country that is most developed in terms of its economy and capital markets. The country must be high income, but this also includes openness to foreign ownership, ease of capital movement, and efficiency of market institutions. This term is contrasted with developing market.
222	Investment	Defined contribution plan	109	A defined contribution (DC) plan is a type of retirement plan in which the employer, employee or both make contributions on a regular basis. Individual accounts are set up for participants and benefits are based on the amounts credited to these accounts plus any investment earnings on the money in the account. In defined contribution plans, future benefits fluctuate on the basis of investment earnings. The most common type of defined contribution plan is a savings and thrift plan. Under this type of plan, the employee contributes a predetermined portion of his or her earnings to an individual account, all or part of which is matched by the employer.
223	Investment	Cost of delay	51	Cost of Delay is "a way of communicating the impact of time on the outcomes we hope to achieve". More formally, it is the partial derivative of the total expected value with respect to time. Cost of Delay combines an understanding of value with how that value leaks away over time.
224	Investment	Core & Satellite	45	Core & Satellite Portfolio Management is an investment strategy that incorporates traditional fixed-income and equity-based securities known as the "core" portion of the portfolio, with a percentage of selected individual securities in the fixed-income and equity-based side of the portfolio known as the "satellite" portion.
225	Investment	Convention of conservatism	80	In accounting, the convention of conservatism, also known as the doctrine of prudence, is a policy of anticipating possible future losses but not future gains. This policy tends to understate rather than overstate net assets and net income, and therefore lead companies to "play safe". When given a choice between several outcomes where the probabilities of occurrence are equally likely, you should recognize that transaction resulting in the lower amount of profit, or at least the deferral of a profit..
226	Investment	Contrarian investing	22	Contrarian Investing is an investment strategy that is characterized by purchasing and selling in contrast to the prevailing sentiment of the time.
227	Investment	Constant proportion portfolio insurance	74	Constant proportion portfolio investment (CPPI) is a trading strategy that allows an investor to maintain an exposure to the upside potential of a risky asset while providing a capital guarantee against downside risk. The outcome of the CPPI strategy is somewhat similar to that of buying a call option, but does not use option contracts. Thus CPPI is sometimes referred to as a convex strategy, as opposed to a "concave strategy" like constant mix.
228	Investment	Constant dollar plan	60	The constant ratio plan was one of the first plans devised when institutions started to invest in the stock market. The plan is often called rebalancing. Another type of plan is called a "variable ratio plan". There are several ways of executing these plans. The simplest is called the Constant Dollar Plan, which has been discussed in various investing books.
229	Investment	The Complete TurtleTrader	33	The Complete TurtleTrader: How 23 Novice Investors Became Overnight Millionaires (2009) is an international bestseller written by Michael Covel. Covel recounts the story of Wall Street’s Richard Dennis and his disciples, the Turtles.
230	Investment	Complementary assets	71	Complementarity is defined as “the total economic value added by combining […] complementary factors in a production system [exceeding] the value that would be generated by applying these production factors in isolation.” Thus two assets are said to be complements when investment in one asset increases the marginal return on the other. On the contrary, assets are substitutes when investment in one does not effect the marginal return of the other.
231	Investment	Collar (finance)	51	In finance, a collar is an option strategy that limits the range of possible positive or negative returns on an underlying to a specific range. A collar strategy is used as one of the ways to hedge against possible losses and it represents long put options financed with short call options.
232	Investment	Circle of competence	100	A circle of competence is the subject area which matches a person's skills or expertise. The mental model was developed by Warren Buffett and Charlie Munger to describe limiting one's financial investments in areas where an individual may have limited understanding or experience, concentrating in areas where one has the greatest familiarity, and to emphasize the importance of aligning a subjective assessment of one own's competence with actual competence. Buffett summarized the concept in the motto, "Know your circle of competence, and stick within it. The size of that circle is not very important; knowing its boundaries, however, is vital."
233	Investment	Churning (finance)	60	Churning is the practice of executing trades for an investment account by a salesman or broker in order to generate commission from the account. It is a breach of securities law in many jurisdictions, and it is generally actionable by the account holder for the return of the commissions paid, and any losses occasioned by the broker's choice of stocks.
234	Investment	Chief Investment Officer Magazine	79	Chief Investment Officer Magazine was an English-language international finance magazine. It is now just a website owned by Strategic Insight. In 2009, the magazine was honored with Folio's Silver Ozzie Award for "Best Design New Magazine, B-to-B." In 2011, the magazine was a finalist for the Jesse H. Neal Award, in the category recognizing Best Subject-Related Series of Articles for their entry, "Interrogations." CIO Magazine's work has also been excerpted in The Atlantic and referenced in New York Magazine.
