120	Investment	Modified Dietz method	22	The modified Dietz method is a measure of the ex post performance of an investment portfolio in the presence of external flows.
121	Investment	Media for equity	107	Media for equity is an alternative investment model which has the main goal of diversifying the revenues stream of a company in a more rational way. Media companies act generally in two different ways: they can either give an unsold advertising space in their publications or a real advertising space equal to a pure cash campaign. The idea is to help the start-up companies increase their metrics in a very short period of time; this way, instead of spending money on online marketing, they can use their financial resources to improve other aspects of their businesses. The companies receive advertising space instead of cash for their stock.
122	Investment	Master–feeder investment structure	31	The master–feeder structure is a technique for structuring investment funds. It allows asset managers to capture the efficiencies of larger pools of assets although fashioning investment funds to separate market niches.
123	Investment	Market trend	71	A market trend is a perceived tendency of financial markets to move in a particular direction over time. These trends are classified as secular for long time frames, primary for medium time frames, and secondary for short time frames. Traders attempt to identify market trends using technical analysis, a framework which characterizes market trends as predictable price tendencies within the market when price reaches support and resistance levels, varying over time.
124	Investment	Market timing	61	Market timing is the strategy of making buying or selling decisions of financial assets by attempting to predict future market price movements. The prediction may be based on an outlook of market or economic conditions resulting from technical or fundamental analysis. This is an investment strategy based on the outlook for an aggregate market, rather than for a particular financial asset.
125	Investment	Market portfolio	37	Market portfolio is a portfolio consisting of a weighted sum of every asset in the market, with weights in the proportions that they exist in the market, with the necessary assumption that these assets are infinitely divisible.
126	Investment	Market neutral	48	An investment strategy or portfolio is considered market-neutral if it seeks to avoid some form of market risk entirely, typically by hedging. To evaluate market-neutrality requires specifying the risk to avoid. For example, convertible arbitrage attempts to fully hedge fluctuations in the price of the underlying common stock.
127	Investment	Market investor	30	There are two basic financial market participant categories, Investor vs. Speculator and Institutional vs. Retail. Action in financial markets by central banks is usually regarded as intervention rather than participation.
128	Investment	Market exposure	43	In finance, market exposure is a measure of the proportion of money invested in the same industry sector. For example, a stock portfolio with a total worth of $500,000, with $100,000 in semiconductor industry stocks, would have a 20% exposure in "chip" stocks.
129	Investment	Market correction	53	A market correction is a rapid change in the nominal price of a commodity, after a barrier to free trade has been removed and the free market establishes a new equilibrium price. It may also refer to several of these single-commodity corrections en masse, as a collective effect over several markets concurrently.
130	Investment	Marginal return	36	Marginal Return is the rate of return for a marginal increase in investment; roughly, this is the additional output resulting from a one-unit increase in the use of a variable input, while other inputs are constant.
131	Investment	Marginal product of capital	56	The marginal product of capital (MPK) is the additional output resulting, ceteris paribus ("all things being equal"), from the use of an additional unit of physical capital. It equals the reciprocal of the incremental capital-output ratio. Mathematically, it is the partial derivative of the production function with respect to capital. If production output , then
132	Investment	Malinvestment	96	In Austrian business cycle theory, malinvestments are badly allocated business investments, due to artificially low cost of credit and an unsustainable increase in money supply. Central banks are often blamed for causing malinvestments, such as the dot-com bubble and the United States housing bubble. Austrian economists such as the Swedish central bank's Nobel Memorial Prize in Economic Sciences laureate F. A. Hayek advocate the idea that malinvestment occurs due to the combination of fractional reserve banking and artificially low interest rates misleading relative price signals which eventually necessitate a corrective contraction—a boom followed by a bust.
133	Investment	Low-volatility investing	74	Low-volatility investing is an investment style that buys securities with low volatility and avoids securities with high volatility. This investment style exploits the low-volatility anomaly. According to financial theory risk and return should be positively related, however in practice this is not true. Low-volatility investors aim to achieve market-like returns, but with lower risk. This investment style is also referred to as minimum volatility, minimum variance, managed volatility, smart beta, defensive and conservative investing.
134	Investment	Lookback option	66	Lookback options, in the terminology of finance, are a type of exotic option with path dependency, among many other kind of options. The payoff depends on the optimal underlying asset's price occurring over the life of the option. The option allows the holder to "look back" over time to determine the payoff. There exist two kinds of lookback options: with floating strike and with fixed strike.
135	Investment	Lock-up period	85	A lock-up period, also known as a lock in, lock out, or locked up period, is a predetermined amount of time following an initial public offering where large shareholders, such as company executives and investors representing considerable ownership, are restricted from selling their shares. Generally, a lock-up period is a condition of exercising an employee stock option. Depending on the company, the IPO lock-up period typically lasts between 90–180 days before these shareholders are allowed the right, but not the obligation, to exercise the option.
136	Investment	Local Investing Opportunity Network	199	A Local Investing Opportunity Network, known as a (LION), is a loosely organized group of people who meet regularly with the goal of investing money in their local community. The group will generally consist of individuals who have money to invest and people who might be in a position where they would be seeking investors. The LION is designed to create opportunities for local businesses, individuals, and local investors to network and develop informal relationships. The U.S. Securities and Exchange Commission has created some very specific laws about how one can ask for money. These laws limit any kind of public offerings of shares/interest in a company, unless there are proper filings and the people investing are considered accredited investors. There is a general exemption that the SEC does not regulate where the investors are friends with the people they are investing in. The LION hosts informal gatherings with the idea that friendships would form and the SEC guidelines would not be violated when any investments occur. The LION also documents who attends the gatherings as a means of creating a paper trail proving that the individuals involved in an investment had the opportunity to form an informal relationship.
137	Investment	List of impact investing firms	0	
138	Investment	Liquidity premium	115	In economics, a liquidity premium is the explanation for a difference between two types of financial securities, that have all the same qualities except liquidity. It is a segment of a three-part theory that works to explain the behavior of yield curves for interest rates. The upwards-curving component of the interest yield can be explained by the liquidity premium. The reason behind this is that short term securities are less risky compared to long term rates due to the difference in maturity dates. Therefore investors expect a premium, or risk premium for investing in the risky security. Liquidity risk premiums are recommended to be used with longer term investments, where those particular investments are illiquid.
139	Investment	Liquid alternative investment	44	Liquid alternatives are alternative investment strategies that are available through alternative investment vehicles such as mutual funds, ETFs, and closed-end funds that provide daily liquidity. Liquid alts are also known as 40 Act funds because they were created by the U.S. Congress in 1940.
140	Investment	Life settlement	83	A life settlement is the "legal" sale of an existing life insurance policy for more than its cash surrender value, but less than its net death benefit ). There are a number of reasons that a policy owner may choose to sell his or her life insurance policy. The policy owner may no longer need or want his or her policy, he or she may wish to purchase a different kind of life insurance policy, or premium payments may no longer be affordable.
141	Investment	Lehman Formula	49	The Lehman Formula, also known as the Lehman Scale, is a formula to define the compensation a bank or finder should receive when arranging for and handling a large underwriting or stock brokerage transfer transaction for a client. The formula usually applies to the entire value of the stock.
142	Investment	Legal Alpha	33	Legal Alpha is the extra performance generated in a specific, diversified investment portfolio by using opportunistic and selective legal activism to obtain compensation for under-performance related to legally relevant unforeseen and uncontrollable circumstances.
143	Investment	Lawcard	18	Aquin Components GmbH LawCards are pre-defined rules covering the investment restrictions of certain jurisdictions for collective investment schemes.
144	Investment	Late trading	36	Late trading is trading that executes after the market closes, while charging the share price of when the market was stil open. This form of trading may be illegal, and is distinct from official after-hours trading.
145	Investment	Land banking	15	Land banking is the practice of aggregating parcels of land for future sale or development.
146	Investment	Laddering	17	Laddering is an investment technique that requires investors to purchase multiple financial products with different maturity dates.
147	Investment	Kurtosis risk	44	In statistics and decision theory, kurtosis risk is the risk that results when a statistical model assumes the normal distribution, but is applied to observations that have a tendency to occasionally be much farther from the average than is expected for a normal distribution.
148	Investment	Irrational exuberance	44	"Irrational exuberance" is the phrase used by the then-Federal Reserve Board chairman, Alan Greenspan, in a speech given at the American Enterprise Institute during the dot-com bubble of the 1990s. The phrase was interpreted as a warning that the stock market might be overvalued.
149	Investment	Investor-state dispute settlement	125	Investor-state dispute settlement (ISDS) or investment court system (ICS) is a system through which investors can sue nation states for alleged discriminatory practices. ISDS is an instrument of public international law and provisions are contained in a number of bilateral investment treaties, in certain international trade treaties, such as the USMCA.A version of this mechanism was also present in the older NAFTA, and the CPTPP and CETA agreements.ISDS is also found in international investment agreements, such as the Energy Charter Treaty. If an investor from one country invests in another country, both of which have agreed to ISDS, and the host state violates the rights granted to the investor under the treaty, then that investor may bring the matter before an arbitral tribunal.
150	Investment	Investor relations	77	Investor relations (IR) is a strategic management responsibility that is capable of integrating finance, communication, marketing and securities law compliance to enable the most effective two-way communication between a company, the financial community, and other constituencies, which ultimately contributes to a company's securities achieving fair valuation. The term describes the department of a company devoted to handling inquiries from shareholders and investors, as well as others who might be interested in a company's stock or financial stability.
151	Investment	Investor profile	65	An investor profile or style defines an individual's preferences in investment decisions, for example:Short term trading or long term holding Risk-averse or risk tolerant / seekerAll classes of assets or just one Value stock, growth stocks, quality stocks, defensive or cyclical stocks...Big cap or small cap stocks,Use or not of derivativesHome turf or international diversificationHands on, or via investment funds
152	Investment	Investor awareness	69	Investor Awareness is a term used in investor relations, by public companies and similar bodies, to describe how well their investors, and the investment market in general, know their business. Its significance is that investors are expected to base their investment decisions on awareness and knowledge, and a lack of these may lead to a low profile amongst its peers in the market, to the detriment of the business.
153	Investment	Investment theory	53	In financial economics, asset pricing refers to a formal treatment and development of two main pricing principles, outlined below, together with the resultant models. There have been many models developed for different situations, but correspondingly, these stem from general equilibrium asset pricing or rational asset pricing, the latter corresponding to risk neutral pricing.
154	Investment	Investment style	18	Investment style refers to different style characteristics of equities, bonds or financial derivatives within a given investment philosophy.
155	Investment	Investment strategy	62	In finance, an investment strategy is a set of rules, behaviors or procedures, designed to guide an investor's selection of an investment portfolio. Individuals have different profit objectives, and their individual skills make different tactics and strategies appropriate. Some choices involve a tradeoff between risk and return. Most investors fall somewhere in between, accepting some risk for the expectation of higher returns.
156	Investment	Investment policy statement	94	An Investment policy statement (IPS) is a document, generally between an investor and the assisting investment manager, recording the agreements the two parties come to with regards to issues relating to how the investor's money is to be managed. In other cases, an IPS may also be created by an investment committee to help establish and record its own policies in order to assist in future decision-making or to help maintain consistency of its policies by future committee members or to clarify expectations for prospective money managers who may be hired by the committee.
157	Investment	Investment Policy Framework for Sustainable Development	139	The Investment Policy Framework for Sustainable Development (IPFSD) is a dynamic document created to help governments formulate sound investment policy, especially international investment agreements (IIAs), that capitalize on foreign direct investment (FDI) for sustainable development. It was prepared by the Division on Investment and Enterprise (DIAE) of the United Nations Conference on Trade and Development (UNCTAD). IPFSD is not a negotiated text or undertaking between States; but rather an initiative by the UNCTAD Secretariat that represents expert guidance while leaving domestic policy makers free to adapt and adopt. IPFSD is the result of numerous consultations with experts and is intended as a platform to provide for further consultation and discussion with all investment stakeholders. The main objective of the IPFSD is to create a balance between the rights and obligations of States and investors while maintaining attractive investment environments.
158	Investment	Investment policy	23	An investment policy is any government regulation or law that encourages or discourages foreign investment in the local economy, e.g. currency exchange limits.
159	Investment	Investment performance	71	Investment performance is the return on an investment portfolio. The investment portfolio can contain a single asset or multiple assets. The investment performance is measured over a specific period of time and in a specific currency. Investors often distinguish different types of return. One is the distinction between the total return and the price return, where the former takes into account income, whereas the latter only takes into account capital appreciation.
160	Investment	Investment goods	20	In economics, investment goods are the goods that enable production, and are the main input into new installed capital.eg:-machine,factory,equipment etc
161	Investment	Investment function	22	The investment function is a summary of the variables that influence the levels of aggregate investments. It can be formalized as follows:
162	Investment	Investment decisions	9	Investment decisions are made by investors and investment managers.
163	Investment	Investment certificate	31	An investment certificate is an investment product offered by an investment company or brokerage firm designed to offer a competitive yield to an investor with the added safety of their principal.
164	Investment	The Investment Answer	54	The Investment Answer, Learn to Manage Your Money & Protect Your Financial Future is a No.1 New York Times bestselling book for individual investors by Daniel C. Goldie, CFA, CFP and Gordon S. Murray. It was first released in paperback in 2010, and later published in hardcover in 2011. It is 96 pages long.
165	Investment	Investment advisory	32	An Investment advisory, in financial/investment organizations, is the unit linking the investment professionals in the central asset management unit to the relationship managers and/or to important clients of the asset management organization.
166	Investment	Inventory investment	116	Inventory investment is a component of gross domestic product (GDP). What is produced in a certain country is naturally also sold eventually, but some of the goods produced in a given year may be sold in a later year rather than in the year they were produced. Conversely, some of the goods sold in a given year might have been produced in an earlier year. The difference between goods produced (production) and goods sold (sales) in a given year is called inventory investment. The concept can be applied to the economy as a whole or to an individual firm, however this concept is generally applied in macro economics Unintended unsold stock of goods increases inventory investment
167	Investment	International investment agreement	121	An International Investment Agreement (IIA) is a type of treaty between countries that addresses issues relevant to cross-border investments, usually for the purpose of protection, promotion and liberalization of such investments. Most IIAs cover foreign direct investment (FDI) and portfolio investment, but some exclude the latter. Countries concluding IIAs commit themselves to adhere to specific standards on the treatment of foreign investments within their territory. IIAs further define procedures for the resolution of disputes should these commitments not be met. The most common types of IIAs are Bilateral Investment Treaties (BITs) and Preferential Trade and Investment Agreements (PTIAs). International Taxation Agreements and Double Taxation Treaties (DTTs) are also considered as IIAs, as taxation commonly has an important impact on foreign investment.
168	Investment	Internal rate of return	42	The internal rate of return (IRR) is a measure of an investment’s rate of return. The term internal refers to the fact that the calculation excludes external factors, such as the risk-free rate, inflation, the cost of capital, or various financial risks.
169	Investment	Intellidex	79	An Intellidex is a securities product created by and proprietary to the American Stock Exchange. Intellidexes are created by analyzing groups of stocks and selecting specific stocks to include in an investment portfolio. These portfolios range from narrow to broad in scope and are usually created based on criteria matching the market as a whole, specific investment styles, or certain industry sectors. Intellidexes and similar products, like exchange-traded funds, are usually traded like normal listed or over-the-counter securities.
170	Investment	Insurance broker	10	An insurance broker sells, solicits, or negotiates insurance for compensation.
171	Investment	Institutional investor	72	An institutional investor is an entity which pools money to purchase securities, real property, and other investment assets or originate loans. Institutional investors include banks, credit unions, insurance companies, pensions, hedge funds, REITs, investment advisors, endowments, and mutual funds. Operating companies which invest excess capital in these types of assets may also be included in the term. Activist institutional investors may also influence corporate governance by exercising voting rights in their investments.
172	Investment	Individual savings account	143	An individual savings account is a class of retail investment arrangement available to residents of the United Kingdom. First introduced in 1999, the accounts have favourable tax status. Payments into the account are made from after-tax income, then the account is exempt from income tax and capital gains tax on the investment returns, and no tax is payable on money withdrawn from the scheme. Cash and a broad range of investments can be held within the arrangement, and there is no restriction on when or how much money can be withdrawn. Since 2017, there are four types of account: cash ISA, stocks & shares ISA, innovative finance ISA (IFISA) and lifetime ISA. Each taxpayer has an annual investment limit which can be split among the four types as desired. Additionally, children under 18 may hold a junior ISA, with a different annual limit.
173	Investment	Individual pension plan	88	An individual pension plan or IPP is a Canadian retirement savings vehicle. An IPP is a one-person maximum defined benefit pension plan which allows the plan member to accrue retirement income on a tax-deferred basis. As such, an IPP must conform to the Canadian Income Tax Act (ITA) and regulations (ITR) as well as the requirements of the Canada Revenue Agency (CRA) with respect to defined benefit pension plans. It is possible for an IPP to be a combination plan offering both defined benefits and defined contribution pensions
174	Investment	Incremental capital-output ratio	99	The Incremental Capital-Output Ratio (ICOR) is the ratio of investment to growth which is equal to the reciprocal of the marginal product of capital. The higher the ICOR, the lower the productivity of capital or the marginal efficiency of capital. The ICOR can be thought of as a measure of the inefficiency with which capital is used. In most countries the ICOR is in the neighborhood of 3. It is a topic discussed in economic growth. It can be expressed in the following formula, where K is capital output ratio, Y is output (GDP), and I is net investment.
175	Investment	Impact investing	37	Impact investing refers to investments "made into companies, organizations, and funds with the intention to generate a measurable, beneficial social or environmental impact alongside a financial return". Impact investments provide capital to address social and/or environmental issues.
176	Investment	Hybrid market	138	A hybrid market allows a stockbroker to choose to have an order executed immediately in a fully automated electronic exchange or to have it routed to the trading floor, where it is completed manually via the more traditional live auction method, in the presence of a specialist broker. The fully electronic method has the advantage of speed, often completing orders in less than one second, but comparable manual transactions take an average of nine seconds. However, the live auction method differentiates itself with the human interaction and expert judgment of the specialists, which are currently seen as obsolete since most customers seem to prefer speed, and the New York Stock Exchange (NYSE) is working to redefine the role played by the specialists in the market. The NYSE is seen as the world's premier example of a hybrid market.
177	Investment	Hybrid Investment	48	Hybrid investments, also known as derivatives or just hybrids, are a form of investment that combines equity and debt features, allowing companies to protect themselves against financial risks in securities transactions. This form of investment is essential for traders and investment professionals to branch out their portfolio assets.
178	Investment	Homemade leverage	36	In finance, homemade leverage is the use of personal borrowing of investors to change the amount of financial leverage of the firm. Investors can use homemade leverage to change an unleveraged firm into a leveraged firm.
179	Investment	Holding period return	36	In finance, holding period return (HPR) is the return on an asset or portfolio over the whole period during which it was held. It is one of the simplest and most important measures of investment performance.
