59	Investment	Risk parity	62	Risk parity is an approach to investment portfolio management which focuses on allocation of risk, usually defined as volatility, rather than allocation of capital. The risk parity approach asserts that when asset allocations are adjusted to the same risk level, the risk parity portfolio can achieve a higher Sharpe ratio and can be more resistant to market downturns than the traditional portfolio.
60	Investment	Rights of accumulation	36	The Right of Accumulation is an investment term for mutual fund transactions, that allows an investor to get lower sales charges on multiple transactions, instead of requiring a single transaction to be over a given amount.
61	Investment	Revolving Loan Fund	117	A Revolving Loan Fund (RLF) is a source of money from which loans are made for multiple small business development projects. Revolving loan funds share many characteristics with microcredit, micro-enterprise, and village banking, namely providing loans to persons or groups of people that do not qualify for traditional financial services or are otherwise viewed as being high risk. Borrowers tend to be small producers of goods and services: typically, they are artisans, farmers, and women with no credit history or access to other types of loans from financial institutions. Organizations that offer revolving loan fund lending aim to help new project or business owners become financially independent and eventually to become eligible for loans from commercial banks.
62	Investment	Reverse convertible securities	117	A reverse convertible security or convertible security is a short-term note linked to an underlying stock. The security offers a steady stream of income due to the payment of a high coupon rate. In addition, at maturity the owner will receive either 100% of the par value or, if the stock value falls, a predetermined number of shares of the underlying stock. In the context of structured product, a reverse convertible can be linked to an equity index or a basket of indices. In such case, the capital repayment at maturity is cash settled, either 100% of principal, or less if the underlying index falls conditional on barrier is hit in the case of barrier reverse convertibles.
63	Investment	Return on investment	62	Return on investment (ROI) is a ratio between net profit and cost of investment. A high ROI means the investment's gains compare favorably to its cost. As a performance measure, ROI is used to evaluate the efficiency of an investment or to compare the efficiencies of several different investments. In economic terms, it is one way of relating profits to capital invested.
64	Investment	Retirement spend-down	59	At retirement, individuals stop working and no longer get employment earnings, and enter a phase of their lives, where they rely on the assets they have accumulated, to supply money for their spending needs for the rest of their lives. Retirement spend-down, or withdrawal rate, is the strategy a retiree follows to spend, decumulate or withdraw assets during retirement.
65	Investment	Resampled efficient frontier	261	In investment portfolio construction, an investor or analyst is faced with determining which asset classes, such as domestic fixed income, domestic equity, foreign fixed income, and foreign equity, to invest in and what proportion of the total portfolio should be of each asset class. Harry Markowitz (1959) first described a method for constructing a portfolio with optimal risk/return characteristics. His portfolio optimization method finds the minimum risk portfolio with a given expected return. Because the Markowitz or Mean-Variance Efficient Portfolio is calculated from the sample mean and covariance, which are likely different from the population mean and covariance, the resulting investment portfolio may allocate too much weight to assets with better estimated than true risk/return characteristics. To account for the uncertainty of the sample estimates, a financial analyst can create many alternative efficient frontiers based on resampled versions of the data. Each resampled dataset will result in a different set of Markowitz efficient portfolios. These efficient frontiers of portfolios can then be averaged to create a resampled efficient frontier. The appropriate compromise between the investor's Risk aversion and desired return will then guide the financial analyst to choose a portfolio from the set of resampled efficient frontier portfolios. Since such a portfolio is different from the Markowitz efficient portfolio it will have suboptimal risk/return characteristics with respect to the sample mean and covariance, but optimal characteristics when averaged over the many possible values of the unknown true mean and covariance. Resampled Efficiency is covered by U. S. patent #6,003,018, patent pending worldwide. New Frontier Advisors, LLC, has exclusive worldwide licensing rights.
66	Investment	Relative return	21	Relative return is a measure of the return of an investment portfolio relative to a theoretical passive reference portfolio or benchmark.
67	Investment	Rebalancing investments	85	The rebalancing of investments is the action / trading strategy of bringing a portfolio that has deviated away from one's target asset allocation back into line. This can be implemented by transferring assets, that is, selling investments of an asset class that is overweight and using the money to buy investments in a class that is underweight, but it also applies to adding or removing money from a portfolio, that is, putting new money into an underweight class, or making withdrawals from an overweight class.
68	Investment	Real assets	48	Real Assets is an investment asset class that covers investments in physical assets such as real estate, energy, and infrastructure. Real assets have an inherent physical worth. Real assets differ from financial assets in that financial assets get their value from a contractual right and are typically intangible.
69	Investment	Rate of return on a portfolio	38	The rate of return on a portfolio is the ratio of the net gain or loss which a portfolio generates, relative to the size of the portfolio. It is measured over a period of time, commonly a year.
70	Investment	Rate of return	59	In finance, return is a profit on an investment. It comprises any change in value of the investment, and/or cash flows which the investor receives from the investment, such as interest payments or dividends. It may be measured either in absolute terms or as a percentage of the amount invested. The latter is also called the holding period return.
71	Investment	Range accrual	81	In finance, a range accrual is a type of derivative product very popular among structured note investors. It is estimated that more than US$160 billion of Range Accrual indexed on interest rates only have been sold to investors between 2004 and 2007. It is one of the most popular non-vanilla financial derivatives. In essence the investor in a range accrual is "betting" that the reference "index" - usually interest rates or currency exchange rates - will stay within a predefined range.
72	Investment	Quantitative value investing	58	Quantitative value investing, also known as systematic value investing, is a form of value investing that analyzes fundamental data such as financial statement line items, economic data, and unstructured data in a rigorous and systematic manner. Practitioners often employ quantitative applications such as statistical / empirical finance or mathematical finance, behavioral finance, natural language processing, and machine learning.
73	Investment	Quantitative fund	21	A quantitative fund is an investment fund in which investment decisions are determined by numerical methods rather than by human judgment.
74	Investment	Quality investing	44	Quality investing is an investment strategy based on a set of clearly defined fundamental criteria that seeks to identify companies with outstanding quality characteristics. The quality assessment is made based on soft and hard criteria. Quality investing supports best overall rather than best-in-class approach.
75	Investment	Qirad	64	The qirad was one of the basic financial instruments of the medieval Islamic world. It was an arrangement between one or more investors and an agent where the investors entrusted capital to an agent who then traded with it in hopes of making profit. Both parties then received a previously settled portion of the profit, though the agent was not liable for any losses.
76	Investment	Pyramid trading	53	Pyramid trading, also known as pyramiding, is a trading strategy which consists of adding to an existing trade or position as the price moves in the expected direction. Doing so reduces the risk levels of an investment, with traders using small increments to increase their holdings rather than betting big from the start.
77	Investment	Psychology of previous investment	52	The "psychology of previous investment" was coined by James Howard Kunstler to describe the sunk costs of the modern urban/suburban lifestyle. It is the reluctance to abandon technologies and standards of urban infrastructure into which humans have already made substantial investments, and is seen as a major contributor to modern energy crises.
78	Investment	Property investment calculator	64	Property investment calculator is a term used to define an application that provides fundamental financial analysis underpinning the purchase, ownership, management, rental and/or sale of real estate for profit. Property Investment Calculators are typically driven by mathematical finance models and converted into source code. Key concepts that drive property investment calculators include returns, cash flow, affordability of financing, investment strategy, equity and risk management.
79	Investment	Private sector involvement	49	In the context of sovereign debt crisis, private sector involvement (PSI) refers, broadly speaking, to the contributions or efforts of private sector creditors to the crisis resolution process, and, specifically, means that the private sector shares some of the costs of a financial crisis by incurring itself financial losses.
80	Investment	Private placement	42	Private placement is a funding round of securities which are sold not through a public offering, but rather through a private offering, mostly to a small number of chosen investors. Generally, these investors include friends and family, accredited investors, and institutional investors.
81	Investment	Private equity fund	76	A private equity fund is a collective investment scheme used for making investments in various equity securities according to one of the investment strategies associated with private equity.Private equity funds are typically limited partnerships with a fixed term of 10 years. At inception, institutional investors make an unfunded commitment to the limited partnership, which is then drawn over the term of the fund. From the investors' point of view, funds can be traditional or asymmetric.
82	Investment	Private equity	23	Private equity (PE) typically refers to investment funds, generally organized as limited partnerships, that buy and restructure companies that are not publicly traded.
83	Investment	Principled reasoning	16	Principled reasoning is an alternative to modern portfolio theory based on a different conception of risk.
84	Investment	Principal protected note	25	A Principal protected note (PPN) is an investment contract with a guaranteed rate of return of at least the amount invested, and a possible gain.
85	Investment	Price return	62	The price return is the rate of return on an investment portfolio, where the return measure takes into account only the capital appreciation of the portfolio, while the income generated by the assets in the portfolio, in the form of interest and dividends, is ignored. This contrasts with the total return, which does take into account the income generated in the portfolio.
86	Investment	Power reverse dual-currency note	156	A dual-currency note (DC) pays coupons in the investor's domestic currency with the notional in the issuer's domestic currency. A reverse dual-currency note (RDC) is a note which pays a foreign interest rate in the investor's domestic currency. A power reverse dual-currency note (PRDC) is a structured product where an investor is seeking a better return and a borrower a lower rate by taking advantage of the interest rate differential between two economies. The power component of the name denotes higher initial coupons and the fact that coupons rise as the foreign exchange rate depreciates. The power feature comes with a higher risk for the investor, which characterizes the product as leveraged carry trade. Cash flows may have a digital cap feature where the rate gets locked once it reaches a certain threshold. Other add-on features include barriers such as knockouts and cancel provision for the issuer. PRDCs are part of the wider Structured Notes Market.
87	Investment	Potential future exposure	22	Potential Future Exposure (PFE) is the maximum expected credit exposure over a specified period of time calculated at some level of confidence.
88	Investment	Post-modern portfolio theory	33	Post-modern portfolio theory is an extension of the traditional modern portfolio theory. Both theories propose how rational investors should use diversification to optimize their portfolios, and how a risky asset should be priced.
89	Investment	Portfolio investment	31	Portfolio investments are investments in the form of a group (portfolio) of assets, including transactions in equity, securities, such as common stock, and debt securities, such as banknotes, bonds, and debentures.
90	Investment	Portfolio insurance	73	Portfolio insurance is a hedging strategy developed to limit the losses an investor might face from a declining index of stocks without having to sell the stocks themselves. The technique was pioneered by Hayne Leland and Mark Rubinstein in 1976. Since its inception, the portfolio insurance strategy has been dubiously marketed as a product. However, this is a misnomer as it is not a policy and there is no insurer of last resort.
91	Investment	Portfolio company	39	A portfolio company is a company or entity in which a venture capital firm, a buyout firm, or a holding company invests. All companies currently backed by a private equity firm can be spoken of as the firm’s portfolio.
92	Investment	Portfolio (finance)	20	In finance, a portfolio is a collection of investments held by an investment company, hedge fund, financial institution or individual.
93	Investment	Portable alpha	69	Portable alpha is a strategy in which portfolio managers separate alpha from beta by investing in securities that are not in the market index from which their beta is derived. Alpha is the return achieved over and above the market return (beta) without taking on more risk. In simple terms, portable alpha is a strategy that involves investing in areas that have little to no correlation with the market.
94	Investment	Philatelic investment	42	Philatelic investment is investment in collectible postage stamps for the purpose of realizing a profit. Philatelic investment was popular during the 1970s but then fell out of favour following a speculative bubble and prices of rare stamps took many years to recover.
95	Investment	Personal pension scheme	40	A personal pension scheme (PPS), sometimes called a personal pension plan (PPP), is a UK tax-privileged individual investment vehicle, with the primary purpose of building a capital sum to provide retirement benefits, although it will usually also provide death benefits.
96	Investment	Personal equity plan	79	A personal equity plan (PEP) was a form of tax-privileged investment account in the United Kingdom, introduced by Nigel Lawson in the 1986 budget to encourage equity ownership among the wider population. PEPs were allowed to contain collective investments such as unit trusts. The single company PEP, which was allowed to contain shares of a single company, was introduced in 1992. PEPs were superseded by individual savings accounts in 1999, and remaining accounts were converted to ISAs in 2008.
97	Investment	Periodic deposit	42	Periodic deposit is the investment made in form of equal deposits over a time period regularly. Each deposit recurs after a time interval. Such an investment is made to achieve a pre-planned financial objective and/or when the capital to invest is less.
98	Investment	Pensions crisis	112	The pensions crisis or pensions timebomb is the predicted difficulty in paying for corporate or government employment retirement pensions in various countries, due to a difference between pension obligations and the resources set aside to fund them. The basic difficulty of the pension problem is that institutions must be sustained over far longer than the political planning horizon. Shifting demographics are causing a lower ratio of workers per retiree; contributing factors include retirees living longer, and lower birth rates. An international comparison of pension institution by countries is important to solve the pension crisis problem. There is significant debate regarding the magnitude and importance of the problem, as well as the solutions.
99	Investment	Payback period	111	Payback period in capital budgeting refers to the time required to recoup the funds expended in an investment, or to reach the break-even point. For example, a $1000 investment made at the start of year 1 which returned $500 at the end of year 1 and year 2 respectively would have a two-year payback period. Payback period is usually expressed in years. Starting from investment year by calculating Net Cash Flow for each year: Net Cash Flow Year 1 = Cash Inflow Year 1 - Cash Outflow Year 1. Then Cumulative Cash Flow = Accumulate by year until Cumulative Cash Flow is a positive number: that year is the payback year.
100	Investment	Pay-for-performance (Investment)	77	A pay-for-performance fee structure, in relation to the investment industry, describes a fee that is paid to a financial advisor or investment manager when their performance returns exceed those of their designated benchmark. The performance fee is generally calculated as a percentage of the investment outperformance gained. The rationale for a pay-for-performance fee is that it provides a low-cost base solution for investors and aligns their interests with investment managers who only get compensated for outstanding performance.
101	Investment	Passive investor	95	A passive investor is one who does not participate in the day-to-day decisions of running a company. In partnerships, such investors may be deemed limited partners rather than general partners. According to Steve Penman, "The passive investor assumes the market is efficient and that stocks are correctly priced to reflect the risk involved in buying the stock." A passive investor relies on the controlling stakeholders and the management to conduct the business of the corporation in such a way as both to maximize its value and to share the upside potential with the passive investor.
102	Investment	Partners Capital	44	Partners Capital Investment Group, LLC is an Outsourced Investment Office (OCIO) that serves endowments, foundations, pensions, investment professionals, and high-net-worth families in Europe, North America and Asia. As of September 2019, the 175-person firm had in excess of $30 billion in assets under management.
103	Investment	Participatory note	48	A participatory note, commonly known as a P-note or PN, is an instrument issued by a registered foreign institutional investor (FII) to an overseas investor who wishes to invest in Indian stock markets without registering themselves with the market regulator, the Securities and Exchange Board of India (SEBI).
104	Investment	Panic selling	87	Panic selling is a wide-scale selling of an investment which causes a sharp decline in prices. Specifically, an investor wants to get out of an investment with little regard of the price obtained. The selling activity is problematic because the investor is selling in reaction to emotion and fear, rather than evaluating the fundamentals. Most major stock exchanges use trading curbs to throttle panic selling, providing a cooling period for people to digest information related to the selling and restore some degree of normalcy to the market.
105	Investment	Pairs trade	59	A pairs trade or pair trading is a market neutral trading strategy enabling traders to profit from virtually any market conditions: uptrend, downtrend, or sideways movement. This strategy is categorized as a statistical arbitrage and convergence trading strategy. Pair trading was pioneered by Gerry Bamberger and later led by Nunzio Tartaglia's quantitative group at Morgan Stanley in the 1980s.
106	Investment	Over-investing	44	Over-investing in finance, particularly personal finance, refers to the practice of investing more into an asset than what that asset is worth on the open market. It is cited most frequently in reference to expensive personal consumable investments such as houses, automobiles, and trailers.
107	Investment	Option naming convention	22	In financial markets, an option naming convention is a method of identifying which of many possible options is being quoted or traded.
108	Investment	Operational due diligence (alternative investments)	28	In alternative investments, operational due diligence (ODD), is an investigation into operational factors of alternative investment entities such as a hedge fund, private equity fund, or infrastructure fund.
109	Investment	Operating partner	123	An operating partner is a term used by venture capital (VC) and private equity (PE) firms to describe a role dedicated to working with privately held companies to increase value. The role was created by large capitalization private equity groups and the importance of driving corporate change in building value increased as sellers became more sophisticated and financial engineering less central to private equity investments in the 2000s.. Firms with such Operating Partners argue that value creation potential is better achieved by a fully dedicated and senior partner than solely relying on external consultants. An operating partner has evolved into a full-time position drawing a combination of salary, performance bonus and carried interest similar to an investment partner in the portfolio investment.
110	Investment	Net present value	88	In finance, the net present value (NPV) or net present worth (NPW) applies to a series of cash flows occurring at different times. The present value of a cash flow depends on the interval of time between now and the cash flow. It also depends on the discount rate. NPV accounts for the time value of money. It provides a method for evaluating and comparing capital projects or financial products with cash flows spread over time, as in loans, investments, payouts from insurance contracts plus many other applications.
111	Investment	Net investment	64	In economics, net investment is spending which increases the availability of fixed capital goods or means of production and goods inventories. It is the total spending on newly produced physical capital and on inventories —that is, gross investment—minus replacement investment, which simply replaces depreciated capital goods. It is productive capital formation plus net additions to the stock of housing and the stock of inventories.
112	Investment	Negative gearing	133	Negative gearing is a form of financial leverage whereby an investor borrows money to acquire an income-producing investment and the gross income generated by the investment is less than the cost of owning and managing the investment, including depreciation and interest charged on the loan. The investor may enter into a negatively geared investment expecting tax benefits or the capital gain on the investment after it is sold to exceed the accumulated losses of holding the investment. The investor would take into account the tax treatment of negative gearing, which may generate additional benefits to the investor in the form of tax benefits if the loss on a negatively geared investment is tax-deductible against the investor's other taxable income and if the capital gain on the sale is given a favourable tax treatment.
113	Investment	National saving	26	In economics, a country's national saving is the sum of private and public saving. It equals a nation's income minus consumption and the government’s taxes levied.
114	Investment	Mutual fund trust	0	
115	Investment	Mortgage note	17	In the United States, a mortgage note is a promissory note secured by a specified mortgage loan.
116	Investment	Moody's Manual	54	Moody's Manual is a series of manuals published by the Moody's Corporation. It was first published in 1900 by John Moody, nine years before he founded Moody's. Initially called Moody's Manual of Industrial and Miscellaneous Securities, it was later superseded by Moody's Manual of Railroads and Corporation Securities, then by Moody's Analyses of Investments.
117	Investment	Money management	23	Money management is the process of expense tracking, investing, budgeting, banking and evaluating taxes of one's money which is also called investment management.
118	Investment	Momentum investing	35	Momentum investing is a system of buying stocks or other securities that have had high returns over the past three to twelve months, and selling those that have had poor returns over the same period.
119	Investment	Modified internal rate of return	54	The modified internal rate of return (MIRR) is a financial measure of an investment's attractiveness. It is used in capital budgeting to rank alternative investments of equal size. As the name implies, MIRR is a modification of the internal rate of return (IRR) and as such aims to resolve some problems with the IRR.
