180	Legal_terminology	Good behaviour bond	127	In the Australian legal system, a good behaviour bond is a type of non-custodial sentence which involves the condition of the offender's “good behaviour” for a set period. The condition of “good behaviour” primarily requires the offender to obey the law, but may also include additional probation officer supervision, mandatory medical treatment or participation in rehabilitation, counselling and intervention programs. These imposed conditions are determined by state legislation and at the magistrate's discretion. A good behaviour bond may be established with or without a recorded legal conviction for the offence. The specific conditions which constitute a good behaviour bond, as well as the consequences for breaching them, vary under each Australian state or territory's legislation, but overall are used most commonly for first-time and juvenile offenders.
181	Legal_terminology	Fundamental justice	190	In Canadian and New Zealand law, fundamental justice is the fairness underlying the administration of justice and its operation. The principles of fundamental justice are specific legal principles that command "significant societal consensus" as "fundamental to the way in which the legal system ought fairly to operate", per R v Malmo-Levine. These principles may stipulate basic procedural rights afforded to anyone facing an adjudicative process or procedure that affects fundamental rights and freedoms, and certain substantive standards related to the rule of law that regulate the actions of the state. The degree of protection dictated by these standards and procedural rights vary in accordance with the precise context, involving a contextual analysis of the affected person's interests. In other words, the more a person's rights or interests are adversely affected, the more procedural or substantive protections must be afforded to that person in order to respect the principles of fundamental justice. A legislative or administrative framework that respects the principles of fundamental justice, as such, must be fundamentally fair to the person affected, but does not necessarily have to strike the "right balance" between individual and societal interests in general.
182	Legal_terminology	Fuero	59	Fuero, Fur, Foro or Foru is a Spanish legal term and concept.The word comes from Latin forum, an open space used as market, tribunal and meeting place. The same Latin root is the origin of the French terms for and foire, and the Portuguese terms foro and foral; all of these words have related, but somewhat different, meanings.
183	Legal_terminology	Freehold (law)	110	In common law jurisdictions like England and Wales, Australia, Canada, and Ireland, a freehold is the common ownership of real property, or land, and all immovable structures attached to such land. It is in contrast to a leasehold: in which the property reverts to the owner of the land after the lease period has expired. For an estate to be a freehold, it must possess two qualities: immobility and ownership of it must be of an indeterminate duration. If the time of ownership can be fixed and determined, it cannot be a freehold. It is "An estate in land held in fee simple, fee tail or for term of life."
184	Legal_terminology	Forged endorsement	55	Forged endorsement is a type of fraudulent payment. For example, someone may write a cheque with a forged signature. In this case the forged signature makes the endorsement fraudulent. Forging endorsements can be use to prevent the person or legal entity that the payment is made out to from being able to receive its value.
185	Legal_terminology	Forfeiture (law)	36	In modern U.S. usage, forfeiture is deprivation or destruction of a right in consequence of the non-performance of some obligation or condition. It can be accidental, and therefore is distinguished from waiver; see waiver and forfeiture.
186	Legal_terminology	Foreign legal opinion	99	A foreign legal opinion is an opinion of a law firm issued in cross-border commercial transactions certifying the effectiveness of the transaction under the applicable foreign law. Foreign legal opinions have become highly standardised over time, and most foreign legal opinions follow a fairly regimented format. The issuance of such opinions has become something of a sub-legal specialisation in itself, and books and articles are written on the subject of foreign legal opinions. A number of organisations issue template format opinions to indicate issues which are intended to be covered by such opinions, or standard form checklists for contents.
187	Legal_terminology	Force (law)	37	In law, force means unlawful violence, or lawful compulsion. "Forced entry" is an expression falling under the category of unlawful violence; "in force" or "forced sale" would be examples of expressions in the category of lawful compulsion.
188	Legal_terminology	Foral	27	The word foral is a noun derived from the Portuguese word foro, ultimately from Latin forum, equivalent to Spanish fuero, Galician foro, Catalan fur and Basque foru.
189	Legal_terminology	Feigned action	49	Feigned action is an action brought on a pretended right, when the plaintiff has no true cause of action, for some illegal purpose. In a feigned action the words of the writ are true; it differs from false action, in which case the words of the writ are false.
190	Legal_terminology	False accounting	17	False accounting is a statutory offence in England and Wales, Northern Ireland and the Republic of Ireland.
191	Legal_terminology	Fair comment	24	Fair comment is a legal term for a common law defense in defamation cases. It is referred to as honest comment in some countries.
192	Legal_terminology	Fact-finding	53	Fact-finding is the job of a person or group of persons in a judicial or administrative proceeding that has or have the responsibility of determining the facts relevant to decide a controversy. The term trier of fact generally denotes the same function. The process is an extremely important part of the communication process.
193	Legal_terminology	Extraordinary resolution	66	In business or commercial law, an extraordinary resolution or special resolution is a resolution passed by the shareholders of a company by a greater majority than is required to pass an ordinary resolution. The precise figures vary in different countries, but commonly an extraordinary resolution must be affirmed by not less than 75% of members casting votes, whereas an ordinary resolution only requires a bare majority.
194	Legal_terminology	Expungement	112	In the common law legal system, an expungement proceeding is a type of lawsuit in which a first time offender of a prior criminal conviction seeks that the records of that earlier process be sealed, making the records unavailable through the state or Federal repositories. If successful, the records are said to be "expunged". Black's Law Dictionary defines "expungement of record" as the "Process by which record of criminal conviction is destroyed or sealed from the state or Federal repository." While expungement deals with an underlying criminal record, it is a civil action in which the subject is the petitioner or plaintiff asking a court to declare that the records be expunged.
195	Legal_terminology	Executor	26	An executor is someone who is responsible for executing, or following through on, an assigned task or duty. The feminine form, executrix, may sometimes be used.
196	Legal_terminology	Estray	29	Estray, in law, is any domestic animal found wandering at large or lost, particularly if the owner is unknown. In most cases this includes domesticated animals and not pets.
197	Legal_terminology	Escrow	129	Being in escrow is a contractual arrangement in which a third party receives and disburses money or property for the primary transacting parties, most generally, used with plentiful terms that conduct the rightful actions that follow. The disbursement is dependent on conditions agreed to by the transacting parties. Examples include an account established by a broker for holding funds on behalf of the broker's principal or some other person until the consummation or termination of a transaction; or, a trust account held in the borrower's name to pay obligations such as property taxes and insurance premiums. The word derives from the Old French word escroue, meaning a scrap of paper or a scroll of parchment; this indicated the deed that a third party held until a transaction was completed.
198	Legal_terminology	Eschatocol	86	An eschatocol, or closing protocol, is the final section of a legal or public document, which may include a formulaic sentence of appreciation; the attestation of those responsible for the document, which may be the author, writer, countersigner, principal parties involved, and witnesses to the enactment or the subscription; or both. It also expresses the context of the documentation of the action described therein, i. e., enunciation of the means of validation and indication of who is responsible to document the act; and the final formulae.
199	Legal_terminology	Dwelling	55	In law, a dwelling is a self-contained unit of accommodation used by one or more households as a home - such as a house, apartment, mobile home, houseboat, vehicle or other "substantial" structure. The concept of a dwelling has significance in relation to search and seizure, conveyancing of real property, burglary, trespass, and land-use planning.
200	Legal_terminology	Duty of Prudence	90	In Trust Law, the Duty of Prudence traditionally includes the duty of a trustee to administer a trust with a degree of care, skill and caution. The degree of care required depends both on the jurisdiction on the trustee's actual or purported skill, for example if they have an accounting background, they must exercise professional care. At a minimum, a trustee is required to act with the care of a "prudent person" would in dealing with the assets of another, given the purposes, terms, and other circumstances of the trust.
201	Legal_terminology	Duplicity (law)	15	Duplicity is the error committed when the charge on an indictment describes two different offences.
202	Legal_terminology	Due process	63	Due process is the legal requirement that the state must respect all legal rights that are owed to a person. Due process balances the power of law of the land and protects the individual person from it. When a government harms a person without following the exact course of the law, this constitutes a due process violation, which offends the rule of law.
203	Legal_terminology	Double majority	58	A double majority is a voting system which requires a majority of votes according to two separate criteria. The mechanism is usually used to require strong support for any measure considered to be of great importance. Typically in legislative bodies, a double majority requirement exists in the form of a quorum being necessary for legislation to be passed.
204	Legal_terminology	Double jeopardy	25	Double jeopardy is a procedural defence that prevents an accused person from being tried again on the same charges following a valid acquittal or conviction.
205	Legal_terminology	Double aspect	111	Double aspect is a legal doctrine in Canadian constitutional law that allows for laws to be created by both provincial and federal governments in relation to the same subject matter. Typically, the federalist system assigns subject matters of legislation to a single head of power. However, certain matters have several dimensions to them such that for one purpose the matter will fall to one head of power, while for another purpose it will fall to the other. For example, highway traffic laws fall into the property and civil rights power of the province but equally can be a criminal offence which is in the criminal law power of the federal government.
206	Legal_terminology	Dissolution (law)	6	In law, dissolution has multiple meanings.
207	Legal_terminology	Direct examination	64	The  direct examination or examination-in-chief is one stage in the process of adducing evidence from witnesses in a court of law. Direct examination is the questioning of a witness by the party who called him or her, in a trial. Direct examination is usually performed to elicit evidence in support of facts which will satisfy a required element of a party's claim or defense.
208	Legal_terminology	Direct evidence	42	Direct evidence supports the truth of an assertion directly, i.e., without an intervening inference. Circumstantial evidence, by contrast, consists of a fact or set of facts which, if proven, will support the creation of an inference that the matter asserted is true.
209	Legal_terminology	Diminishment	19	Diminishment is the legal process by which the United States Congress can reduce the size of an Indian reservation.
210	Legal_terminology	Designation (law)	48	Designation is the process of determining an incumbent's successor. A candidate that won an election for example, is the designated holder of the office the candidate has been elected to, up until the candidate's inauguration. Titles typically held by such persons include, amongst others, "President-elect", and "Prime Minister-designate".
211	Legal_terminology	Demurrage	101	The term "demurrage" from Old French demeurage, from demeurer - to linger, tarry - originated in vessel chartering and referred to the period when the charterer remained in possession of the vessel after the period normally allowed to load and unload cargo (laytime). By extension, demurrage refers to the charges that the charterer pays to the ship owner for its delayed operations of loading/unloading. Officially, demurrage is a form of liquidated damages for breaching the laytime as it is stated in the governing contract. The demurrage sometimes causes a loss to the seller as it increases cost of the total freight.
212	Legal_terminology	Demise	34	Demise, in its original meaning, is an Anglo-Norman legal term for the transfer of an estate, especially by lease. The word has an operative effect in a lease, implying a covenant "for quiet enjoyment."
213	Legal_terminology	Demand guarantee	56	A demand guarantee is a guarantee that must be honoured by the guarantor upon beneficiary's demand. The beneficiary is not required to first make a claim or take any action against the obligor of the guaranteed obligation that the guarantee supports. A demand guarantee is enforceable notwithstanding any deficiencies in the enforceability of the underlying obligation.
214	Legal_terminology	Deforce	44	Deforce is a legal term, meaning to unlawfully withhold land from its true owner or from any other person who has a right to the possession of it, after one has lawfully entered and taken possession of it. See e.g. 3 Bl Comm 172.
215	Legal_terminology	Default (law)	23	In law, a default is the failure to do something required by law or to appearat a required time in legal proceedings.
216	Legal_terminology	Declaratory power	38	The declaratory power, in Scots law, is an unusual power held by the High Court of Justiciary, which enables it to declare behaviour to be criminal, even if that behaviour had not been previously defined as criminal activity.
217	Legal_terminology	Date certain	29	Date certain is a legal term for the date on or by which the actions of a contract can be reasonably completed, and is considered to be legally binding.
218	Legal_terminology	Course of dealing	53	The term course of dealing is defined in the Uniform Commercial Code as follows:A "course of dealing" is a sequence of conduct concerning previous transactions between the parties to a particular transaction that is fairly to be regarded as establishing a common basis of understanding for interpreting their expressions and other conduct.
219	Legal_terminology	Consumer complaint	59	A consumer complaint or customer complaint is "an expression of dissatisfaction on a consumer's behalf to a responsible party". It can also be described in a positive sense as a report from a consumer providing documentation about a problem with a product or service. In fact, some modern business consultants urge businesses to view customer complaints as a gift.
220	Legal_terminology	Constructive notice	40	Constructive notice is the legal fiction that signifies that a person or entity should have known, as a reasonable person would have, of a legal action taken or to be taken, even if they have no actual knowledge of it.
221	Legal_terminology	Constructive fraud	52	Constructive fraud is a legal fiction describing a situation where a person or entity gained an unfair advantage over another by deceitful or unfair methods. Intent does not need to be shown as in the case of actual fraud. Some unfair methods may include not telling customers about defects in a product.
222	Legal_terminology	Connivance	35	Connivance is the act of conniving or conspiring, especially with the knowledge of and active or passive consent to wrongdoing or a twist in truth, to make something appear as something that it is not.
223	Legal_terminology	Competent authority	49	A competent authority is any person or organization that has the legally delegated or invested authority, capacity, or power to perform a designated function. Similarly, once an authority is delegated to perform a certain act, only the competent authority is entitled to take accounts therefrom and no one else.
224	Legal_terminology	Compass (law)	35	In Law, to compass is to purpose something. It is an individual that is imagining something or to plot a plan. Compassing signifies a purpose of the mind, and not carrying such design to effect.
225	Legal_terminology	Common carrier	96	A common carrier in common law countries is a person or company that transports goods or people for any person or company and is responsible for any possible loss of the goods during transport. A common carrier offers its services to the general public under license or authority provided by a regulatory body, which has usually been granted "ministerial authority" by the legislation that created it. The regulatory body may create, interpret, and enforce its regulations upon the common carrier with independence and finality as long as it acts within the bounds of the enabling legislation.
226	Legal_terminology	Coming into force	37	Coming into force or entry into force is the process by which legislation, regulations, treaties and other legal instruments come to have legal force and effect. The term is closely related to the date of this transition.
227	Legal_terminology	Coercion	140	Coercion is the practice of forcing another party to act in an involuntary manner by use of threats or force. It involves a set of various types of forceful actions that violate the free will of an individual to induce a desired response, for example: a bully demanding lunch money from a student or the student gets beaten. These actions may include extortion, blackmail, torture, threats to induce favors, or even sexual assault. In law, coercion is codified as a duress crime. Such actions are used as leverage, to force the victim to act in a way contrary to their own interests. Coercion may involve the actual infliction of physical pain/injury or psychological harm in order to enhance the credibility of a threat. The threat of further harm may lead to the cooperation or obedience of the person being coerced.
228	Legal_terminology	Citizen's arrest	46	A citizen's arrest is an arrest made by a person who is not acting as a sworn law-enforcement official. In common law jurisdictions, the practice dates back to medieval England and the English common law, in which sheriffs encouraged ordinary citizens to help apprehend law breakers.
229	Legal_terminology	Charging order	53	A charging order, in English law, is an order obtained from a court or judge by a judgment creditor, by which the property of the judgment debtor in any stocks or funds or land stands charged with the payment of the amount for which judgment shall have been recovered, with interest and costs.
230	Legal_terminology	Charge (youth)	65	During the European Middle Ages, a charge often meant an underage person placed under the supervision of a nobleman. Charges were the responsibility of the nobleman they were charged to, and they were usually expected to be treated as guests or a member of the household. Charges were at times used more or less openly as hostages, in order to keep their parents in line.
231	Legal_terminology	Champerty and maintenance	82	Champerty and maintenance are doctrines in common law jurisdictions that aim to preclude frivolous litigation:Maintenance is the intermeddling of a disinterested party to encourage a lawsuit. It is: "A taking in hand, a bearing up or upholding of quarrels or sides, to the disturbance of the common right."Champerty is the "maintenance" of a person in a lawsuit on condition that the subject matter of the action is to be shared with the maintainer. Among laymen, this is known as litigation finance.
232	Legal_terminology	Cestui que	98	Cestui que is a shortened version of cestui a que use le feoffment fuit fait, literally, "The person for whose benefit the feoffment was made." It is a Law French phrase of medieval English invention, which appears in the legal phrases cestui que trust, cestui que use, or cestui que vie. In contemporary English the phrase is also commonly pronounced "setty-kay" or "sesty-kay". According to Roebuck, Cestui que use is pronounced "setticky yuce". Cestui que use and cestui que trust are more or less interchangeable terms. In some medieval materials, the phrase is seen as cestui a que.
233	Legal_terminology	Cease and desist	81	A cease and desist letter is a document sent to an individual or business to stop purportedly illegal activity ("cease") and not to restart it ("desist"). The letter may warn that if the recipient does not discontinue specified conduct, or take certain actions, by deadlines set in the letter, that party may be sued. When issued by a public authority, a cease and desist letter, being "a warning of impending judicial enforcement", is most appropriately called a "cease and desist order".
234	Legal_terminology	Cause of death	71	In law, medicine, and statistics, cause of death is an official determination of conditions resulting in a human's death, which may be recorded on a death certificate. A cause of death is determined by a medical examiner. The cause of death is a specific disease or injury, in contrast to the manner of death which is a small number of categories like "natural", "accident", and "homicide", which have different legal implications.
235	Legal_terminology	Cause célèbre	89	A cause célèbre is an issue or incident arousing widespread controversy, outside campaigning, and heated public debate. The term continues in the media in all senses. It is sometimes used positively for celebrated legal cases for their precedent value and more often negatively for infamous ones, whether for scale, outrage, scandal or conspiracy theories. The term is a French phrase in common usage in English. Since it has been fully adopted into English and is included unitalicized in English dictionaries, it is not normally italicized despite its French origin.
236	Legal_terminology	Capital call	67	A capital call is a legal right of an investment firm or an insurance firm to demand a portion of the money promised to it by an investor. A capital call fund would be the money that had been committed to the fund. The capital call is the act of actually transferring the promised funds to the investment target. A capital call agreement defines capital call terms.
237	Legal_terminology	Bodily harm	72	Bodily harm is a legal term of art used in the definition of both statutory and common law offences in Australia, Canada, England and Wales and other common law jurisdictions. It is a synonym for injury or bodily injury and similar expressions, though it may be used with a precise and limited meaning in any given jurisdiction. The expression grievous bodily harm first appeared in a statute in Lord Ellenborough's Act (1803).
238	Legal_terminology	Blunt instrument	79	A blunt instrument is any solid object used as a weapon, which damages its target by applying direct mechanical force, and has no penetrating point or edge, or is wielded so that the point or edge is not the part of the weapon that inflicts the injury. Blunt instruments may be contrasted with edged weapons, which inflict injury by cutting or stabbing, or projectile weapons, where the projectiles, such as bullets or arrows, are accelerated to a damaging speed.
239	Legal_terminology	Beneficiary	50	A beneficiary in the broadest sense is a natural person or other legal entity who receives money or other benefits from a benefactor. For example, the beneficiary of a life insurance policy is the person who receives the payment of the amount of insurance after the death of the insured.
240	Legal_terminology	Banker's lien	40	A banker's lien is a legal right arise in many common law jurisdictions of a bank to exercise a lien over any property in the custody of the bank as security for the indebtedness of the customer to the bank.
241	Legal_terminology	Back-bond	66	Back-bond, or back-letter, in Scots law, is a deed qualifying the terms of another deed, or declaratory of the purposes for which another deed has been granted. Thus an ex facie absolute disposition, qualified by a back-bond expressing the limited nature of the right actually held by the person to whom the disposition is made, would constitute what in England is termed a deed of trust.
242	Legal_terminology	Assisting Offender	38	An Assisting Offender is a suspected or convicted criminal in the United Kingdom, who has agreed to assist the investigation or prosecution of other criminals in return for some form of sentence reduction on their own criminal history.
