54	Legal_terminology	Royal assent	113	Royal assent is the method by which a monarch formally approves an act of the legislature. In some jurisdictions, royal assent is equivalent to promulgation, while in others that is a separate step. Under a modern constitutional monarchy royal assent is considered to be little more than a formality; even in those nations which still, in theory, permit the Monarch to withhold assent to laws, the Monarch almost never does so, except in a dire political emergency or upon the advice of their government. While the power to veto a law by withholding royal assent was once exercised often by European monarchs, such an occurrence has been very rare since the eighteenth century.
55	Legal_terminology	Responsible entity	41	A responsible entity is a peculiarly Australian invention designed to replace the manager/trustee in managed investment schemes. It was created by the Managed Investments Act 1998, which made significant amendments to the prescribed interest provisions contained in the Australian Corporations Act. 
56	Legal_terminology	Respite (law)	26	A respite is a delay in the imposition of sentence but in no way modifies a sentence or addresses questions of due process, guilt or innocence.
57	Legal_terminology	Reservation of rights	49	A reservation of rights, in American legal practice, is a statement that one is intentionally retaining his full legal rights to warn others of those rights. The notice avoids later claims that one waived legal rights that were held under a contract, copyright law, or any other applicable law.
58	Legal_terminology	Remand (imprisonment)	75	Remand is the process of detaining a person who has been arrested and charged with an offense until their trial. A person who is on remand is held in a prison or detention center, or held under house arrest. Varying terminology is used, but "remand" is generally used in common law jurisdictions and in Europe "preventive detention". Detention before charge is referred to as custody and continued detention after conviction is referred to as imprisonment.
59	Legal_terminology	Relevant conduct	73	Relevant conduct is an important concept in the U.S. Sentencing Guidelines. According to the U.S. Court of Appeals for the 2nd Circuit, relevant conduct is "almost a term of art as a result of its detailed exposition in Sections 1B1.3, 4 ; and 3D1.2(d) ." The U.S. Sentencing Commission notes, "Deemed the 'cornerstone' of the federal sentencing guidelines, relevant conduct defines the scope of behavior that must be considered in every federal case."
60	Legal_terminology	Related rights	58	In copyright law, related rights are the rights of a creative work not connected with the work's actual author. It is used in opposition to the term "authors' rights". Neighbouring rights is a more literal translation of the original French droits voisins. Both authors' rights and related rights are copyrights in the sense of English or U.S. law.
61	Legal_terminology	Related party transaction	72	In business, a related party transaction is a transaction that takes place between two parties who hold a pre-existing connection prior to the transaction. An example is how a dominant shareholder may benefit from making one of their companies trade to the other at advantageous prices. Related party transactions can be a reason for a Type II agency relationship, as it is not necessarily in the best interest of minority share owners.
62	Legal_terminology	Rectification (law)	42	Rectification is a remedy whereby a court orders a change in a written document to reflect what it ought to have said in the first place. It is an equitable remedy, which means the circumstances where it can be applied are limited.
63	Legal_terminology	Recharacterisation	22	Recharacterisation in law means the treatment of a certain course of conduct in a different manner to which the participants describe it.
64	Legal_terminology	Reasonability	69	Reasonability is a legal term. The scale of reasonability represents a quintessential element of modern judicial systems and is particularly important in the context of international disputes and conflicts of laws issues. The concept is founded on the notion that all parties should be held to a reasonable standard of conduct and has become embedded in a number of international conventions such as the UNIDROIT principles and the CISG.
65	Legal_terminology	Pupil master	222	A pupil master or in the case of a female barrister, 'pupil mistress' etc., is the former name given to an experienced barrister who a pupil shadows during their pupillage. The term pupil master or mistress has now been replaced by the term 'pupil supervisor'. Barristers are called to the Bar via one of the four Inns of Court upon successful completion of the BPTC and having undertaken a required number of "qualifying sessions" in their chosen Inn of Court. In most cases, the newly called barrister is then required to undertake training for a period of at least a year before the barrister can start their own private practice. This training period is known as pupillage, usually split into two periods of six months known as "sixes". The first "six" is a non-practising six, during which the pupil will shadow their pupil master; the second is usually a practising "six", when the pupil, with their pupil master's permission, can undertake the supply of legal services and exercise rights of audience in court. Occasionally, a pupil barrister may undertake a third "six", extending the training period a further six months. At the end of pupillage, to continue practising the law, a barrister may attempt to become a tenant in a set of barristers' chambers, or find a position as an employed barrister.
66	Legal_terminology	Punitive damages	64	Punitive damages, or exemplary damages, are damages assessed in order to punish the defendant for outrageous conduct and/or to reform or deter the defendant and others from engaging in conduct similar to that which formed the basis of the lawsuit. Although the purpose of punitive damages is not to compensate the plaintiff, the plaintiff will receive all or some of the punitive damages award.
67	Legal_terminology	Public service company	75	A public service company is a corporation or other non-governmental business entity which delivers public services - certain services considered essential to the public interest. The ranks of such companies include public utility companies like natural gas, pipeline, electricity, and water supply companies, sewer companies, telephone companies and telegraph companies. They also include public services such as transportation of passengers or property as a common carrier, such as airlines, railroads, trucking, bus, and taxicab companies.
68	Legal_terminology	Prosecutorial immunity	72	Prosecutorial immunity is the absolute immunity that prosecutors in the United States have in initiating a prosecution and presenting the state's case. "Firming up what had long been held as common practice, the U.S. Supreme Court in 1976 ruled in Imbler v. Pachtman that prosecutors cannot face civil lawsuits for prosecutorial abuses, no matter how severe." Prosecutors have qualified immunity in other activities such as advising police and speaking to the press.
69	Legal_terminology	Promise	65	A promise is a commitment by someone to do or not do something. As a noun promise means a declaration assuring that one will or will not do something. As a verb it means to commit oneself by a promise to do or give. It can also mean a capacity for good, similar to a value that is to be realized in the near future.
70	Legal_terminology	Procuration	47	Procuration is the action of taking care of, hence management, stewardship, agency. The word is applied to the authority or power delegated to a procurator, or agent, as well as to the exercise of such authority expressed frequently by procuration, or shortly per pro., or simply p.p.
71	Legal_terminology	Proclamation	40	A proclamation is an official declaration issued by a person of authority to make certain announcements known. Proclamations are currently used within the governing framework of some nations and are usually issued in the name of the head of state.
72	Legal_terminology	Probate sale	70	A probate sale is the process executed at a county court where the executor for the estate of a deceased person sells property from the estate in order to divide the property among the beneficiaries. There is a personal representative of the estate who will determine if the real estate is going to be sold. A personal representative is not required to use the services of a real estate broker.
73	Legal_terminology	Probate	65	Probate is the judicial process whereby a will is "proved" in a court of law and accepted as a valid public document that is the true last testament of the deceased, or whereby the estate is settled according to the laws of intestacy in the state of residence [or real property] of the deceased at time of death in the absence of a legal will.
74	Legal_terminology	Privilege tax	32	A privilege tax is a tax levied in exchange for a privilege or license granted to the taxpayer. The fee for registering a motor vehicle is one example of a privilege tax.
75	Legal_terminology	Principle of no-work-no-pay (dies non)	41	According to Merriam-Webster's Dictionary of Law, Dies non  is a part of the Latin phrase literally meaning "a day when courts do not sit or carry on business". Dies non juridicum is the full Latin phrase literally meaning "Day without judiciary.
76	Legal_terminology	Principal case	38	The term principal case refers to a legal case that is deemed basic to understanding a legal principle. As a result, it may also refer to the case in a casebook that introduces a discussion of that principle.
77	Legal_terminology	Principal (criminal law)	36	Under criminal law, a principal is any actor who is primarily responsible for a criminal offense. Such an actor is distinguished from others who may also be subject to criminal liability as accomplices, accessories or conspirators.
78	Legal_terminology	Presentment	23	A presentment can be defined as the act of presenting to an authority a formal statement of a matter to be dealt with.
79	Legal_terminology	Prerogative	93	In law, a prerogative is an exclusive right bestowed by a government or state and invested in an individual or group, the content of which is separate from the body of rights enjoyed under the general law. It was a common facet of feudal law. The word is derived from O.Fr. prerogative (14c.), M.L. prerogativa "special right", from L. praerogativa "prerogative, previous choice or election", originally "100 banane unite o scolpite in maniera tale da essere evidentivoters who by lot voted first in the Roman comitia," from praerogativus (adj.) "chosen to vote first."
80	Legal_terminology	Preparation and attempt	11	Preparation and attempt are related, but different standards in criminal law.
81	Legal_terminology	Prejudice (legal term)	43	Prejudice is a legal term with different meanings when used in criminal, civil, or common law. Often the use of prejudice in legal context differs from the more common use of the word and thus has specific technical meanings implied by its use.
82	Legal_terminology	Preamble	53	A preamble is an introductory and expressionary statement in a document that explains the document's purpose and underlying philosophy. When applied to the opening paragraphs of a statute, it may recite historical facts pertinent to the subject of the statute. It is distinct from the long title or enacting formula of a law.
83	Legal_terminology	Prayer for relief	77	A prayer for relief, in the law of civil procedure, is a portion of a complaint in which the plaintiff describes the remedies that the plaintiff seeks from the court. For example, the plaintiff may ask for an award of compensatory damages, punitive damages, attorney's fees, an injunction to make the defendant stop a certain activity, or all of these. The request for a specific amount of money may be referred to as an ad damnum clause.
84	Legal_terminology	Praelegal	82	PraeLegal refers to second period of the Roman era. After praetor lost his power and Rome became a republic, the senate tried to bring on new changes based on ancient-logical laws of Rome and Greece. In a broader sense, PRAE LEGAL is a directorate which will consist of independent law firms with successful and trusty legal skills, knowledge of the local market and industry expertise, having strong connections with political and business circles and capable of providing cross-border co-ordination of multi-jurisdictional matters.
85	Legal_terminology	Position of trust	39	A position of trust is any position that requires its holder to enjoy the trust of those who elected or chose the holder. It is often used in a more restricted sense defined by an organization or by legislation.
86	Legal_terminology	Police caution	46	A police caution is a formal alternative to prosecution in minor cases, administered by the police in England and Wales. It is commonly used to resolve cases where full prosecution is not seen as the most appropriate solution. Accepting a caution requires an admission of guilt.
87	Legal_terminology	Plurality opinion	62	A plurality opinion is in certain legal systems the opinion from a group of judges, often in an appellate court, in which no single opinion supports a majority of the court. The plurality opinion did not receive the support of more than half the justices, but received more support than any other opinion, excluding those dissenting from the holding of the court.
88	Legal_terminology	Plenary power	31	A plenary power or plenary authority is a complete and absolute power to take action on a particular issue, with no limitations. It is derived from the Latin term plenus ("full").
89	Legal_terminology	Plea bargain	88	The plea bargain is any agreement in a criminal case between the prosecutor and defendant whereby the defendant agrees to plead guilty or nolo contendere to a particular charge in return for some concession from the prosecutor. This may mean that the defendant will plead guilty to a less serious charge, or to one of the several charges, in return for the dismissal of other charges; or it may mean that the defendant will plead guilty to the original criminal charge in return for a more lenient sentence.
90	Legal_terminology	Plant variety (law)	66	Plant variety is a legal term, following the International Union for the Protection of New Varieties of Plants (UPOV) Convention. Recognition of a cultivated plant as a "variety" in this particular sense provides its breeder with some legal protection, so-called plant breeders' rights, depending to some extent on the internal legislation of the UPOV signatory countries, such as the Plant Variety Protection Act in the US.
91	Legal_terminology	Personal representative	113	In common law jurisdictions, a personal representative or legal personal representative is a person appointed by a court to administer the estate of another person. If the estate being administered is that of a deceased person, the personal representative is either an executor if the deceased person left a will or an administrator of an intestate estate. In other situations, the personal representative may be a guardian or trustee, or other position. As a fiduciary, a personal representative has the duties of loyalty, candor or honesty, and good faith. In the United States, punctilio of honor, or the highest standard of honor, is the level of scrupulousness that a fiduciary must abide by.
92	Legal_terminology	Person of interest	70	"Person of interest" is a term used by U.S. law enforcement when identifying someone involved in a criminal investigation who has not been arrested or formally accused of a crime. It has no legal meaning, but refers to someone in whom the police are "interested," either because the person is cooperating with the investigation, may have information that would assist the investigation, or possesses certain characteristics that merit further attention.
93	Legal_terminology	Perjury trap	32	A perjury trap is a form of prosecutorial misconduct in which a prosecutor calls a witness to testify, typically before a grand jury, with the intent of coercing the witness into perjury.
94	Legal_terminology	Perjury	122	Perjury is the intentional act of swearing a false oath or falsifying an affirmation to tell the truth, whether spoken or in writing, concerning matters material to an official proceeding. In some jurisdictions, contrary to popular misconception, no crime has occurred when a false statement is made while under oath or subject to penalty. Instead, criminal culpability attaches only at the instant the declarant falsely asserts the truth of statements that are material to the outcome of the proceeding. For example, it is not perjury to lie about one's age except if age is a fact material to influencing the legal result, such as eligibility for old age retirement benefits or whether a person was of an age to have legal capacity.
95	Legal_terminology	Perfection (law)	100	In law, perfection relates to the additional steps required to be taken in relation to a security interest in order to make it effective against third parties or to retain its effectiveness in the event of default by the grantor of the security interest. Generally speaking, once a security interest is effectively created, it gives certain rights to the holder of the security and imposes duties on the party who grants that security. However, in many legal systems, additional steps --- perfection of the security interest --- are required to enforce the security against third parties such as a liquidator.
96	Legal_terminology	Peremptory plea	47	In the common law, the peremptory pleas are defensive pleas that set out special reasons for which a trial cannot proceed; they serve to bar the case entirely. Pleas in bar may be used in civil or criminal cases; they address the substantial merits of the case.
97	Legal_terminology	Peon	67	Peon usually refers to a person subject to peonage: any form of unfree labour or wage labor in which a laborer (peon) has little control over employment conditions. Peon and peonage can refer to the colonial period in Latin America and other countries colonized by Spain as well as the period after U.S. Civil War when "Black Codes" were passed to maintain black labour through other means.
98	Legal_terminology	Peliculum in mora	167	Peliculu in mora, Latin for "danger in delay", is one of two conditions which must be asserted in actions aimed at obtaining a protective order or injunction, to be granted the relief sought. The second condition is the c.d. Prima facie case.The burden of proof of danger in delay falls to the person who requests the injunction or order, demonstrating the existence of both requirements, periculum notice, and the risk of suffering serious and irreparable damage.The term 'serious harm' refers to the magnitude of the damages, calculated in relation to the value of the property in dispute: an injury will not be so serious in itself, but only when compared to the object of contention. Irreparable damage is in the possibility of a remedy in the future against which the party seeking the injunction believes they will suffer. Only asset orientation is currently supported, in that the prevailing possibility of obtaining compensation for damages is, in itself, sufficient to prevent the founding of irreparable harm.
99	Legal_terminology	Payment	22	A payment is the trade of value from one party to another for goods, or services, or to fulfill a legal obligation.
100	Legal_terminology	Party (law)	51	A party is a person or group of persons that compose a single entity which can be identified as one for the purposes of the law. Parties include: plaintiff, defendant, petitioner, respondent, cross-complainant, or cross-defendant. A person who only appears in the case as a witness is not considered a party.
101	Legal_terminology	Partible inheritance	47	Partible inheritance is a system of inheritance in which property is apportioned among heirs. It contrasts in particular with primogeniture, which requires that the whole or most of the inheritance passes to the eldest son, and with agnatic seniority where the succession passes to next senior male.
102	Legal_terminology	Partial verdict	27	In criminal law, a partial verdict occurs when the jury finds the defendant guilty or not guilty on some, but not all, of the charges against them.
103	Legal_terminology	Parole	38	Parole is the early release of a prisoner who agrees to abide by certain conditions, originating from the French word parole. The term became associated during the Middle Ages with the release of prisoners who gave their word.
104	Legal_terminology	Parental consent	27	Parental consent laws in some countries require that one or more parents consent to or be notified before their minor child can legally engage in certain activities.
105	Legal_terminology	Pardon	45	A pardon is a government decision to allow a person to be relieved of some or all of the legal consequences resulting from a criminal conviction. A pardon may be granted before or after conviction for the crime, depending on the laws of the jurisdiction.
106	Legal_terminology	Pain and suffering	17	Pain and suffering is the legal term for the physical and emotional stress caused from an injury.
107	Legal_terminology	Ownership	43	Ownership is the state or fact of exclusive rights and control over property, which may be an object, land or real estate, or intellectual property. Ownership involves multiple rights, collectively referred to as title, which may be separated and held by different parties.
108	Legal_terminology	Overcharge	84	Overcharge is an economic term that refers to the difference between an observed market price and a price that would have been observed in the absence of collusion. The latter is often called a "but-for price" or a competitive "benchmark price". When collusion is not in use, such as by privately owned businesses, overcharge is considered as a markup of the observed market price for the sole profit of the business and in some states is considered illegal, similar to profiteering and price gouging.
109	Legal_terminology	Originating application	28	An originating application is the first, provisional, or primary application in any legal process, such as a lawsuit, application for a real estate mortgage, patent, or bankruptcy petition.
110	Legal_terminology	Ordinary resolution	58	In business or commercial law in certain common law jurisdictions, an ordinary resolution is a resolution passed by the shareholders of a company by a simple or bare majority either at a convened meeting of shareholders or by circulating a resolution for signature. A special resolution by comparison requires a greater vote threshold, which varies in different jurisdictions.
111	Legal_terminology	Opinion privilege	69	Opinion privilege is a protected form of speech, of importance to US federal and state law. The US First Amendment guarantees free speech, subject to certain limitations. One of these limitations is defamation, in various forms, notably libel. While federal precedent does not explicitly state that opinion is protected against prosecution under libel laws, the combined effect of several rulings is such as to effectively make such the case.
112	Legal_terminology	Operative fact	15	An operative fact is a legally relevant fact that establishes a legal relationship between persons.
113	Legal_terminology	Open verdict	79	The open verdict is an option open to a coroner's jury at an inquest in the legal system of England and Wales. The verdict means the jury confirms the death is suspicious, but is unable to reach any other verdicts open to them. Mortality studies consider it likely that the majority of open verdicts are recorded in cases of suicide where the intent of the deceased could not be proved, although the verdict is recorded in many other circumstances.
114	Legal_terminology	Omnibus hearing	37	An omnibus hearing is a pretrial hearing. It is usually held soon after a defendant's arraignment. The main purpose of the hearing is to determine the evidence, including testimony and evidence seized at the time of arrest.
115	Legal_terminology	Offer of proof	104	An offer of proof is a kind of motion that a lawyer may present to a judge or to the official presiding over an administrative hearing. It is an explanation made by an attorney to a judge during trial to show why a question which has been objected to as immaterial or irrelevant will lead to evidence of value to proving the case of the lawyer's client. Often the judge will ask: "Where is this line of questions going?" and the offer of proof is the response. The offer provides the opposition a preview of the questions, but is essential to overcome the objections.
116	Legal_terminology	Nota bene	112	Nota bene is a Latin phrasewhich first appeared in English writing c. 1711. Often abbreviated as NB, n.b., or with the ligature , the phrase is Latin for "note well" and comes from the Latin roots notāre and bene ("well"). It is in the singular imperative mood, instructing one individual to note well the matter at hand, i.e., to take notice of or pay special attention to it. In Modern English, it is used, particularly in legal papers, to draw the attention of the reader to a certain (side) aspect or detail of the subject being addressed. While NB is also often used in academic writing, note is a common substitute.
117	Legal_terminology	Nonjoinder of party	23	In law, a nonjoinder of party refers to the omission of a necessary party to an action. 39 Am J1st Parties § 110.
