1	Legal_terminology	Voting trust	83	A voting trust is an arrangement whereby the shares in a company of one or more shareholders and the voting rights attached thereto are legally transferred to a trustee, usually for a specified period of time. In some voting trusts, the trustee may also be granted additional powers. At the end of the trust period, the shares would ordinarily be re-transferred to the beneficiary(ies), although in practice many voting trusts contain provisions for them to re-vested on the voting trusts with identical terms.
2	Legal_terminology	Voluntary association	40	A voluntary group or union is a group of individuals who enter into an agreement, usually as volunteers, to form a body to accomplish a purpose. Common examples include trade associations, trade unions, learned societies, professional associations, and environmental groups.
3	Legal_terminology	Voidable	35	Voidable, in law, is a transaction or action that is valid but may be annulled by one of the parties to the transaction. Voidable is usually used in distinction to void ab initio and unenforceable.
4	Legal_terminology	Void (law)	94	In law, void means of no legal effect. An action, document, or transaction which is void is of no legal effect whatsoever: an absolute nullity—the law treats it as if it had never existed or happened. The term void ab initio, which means "to be treated as invalid from the outset," comes from adding the Latin phrase ab initio as a qualifier. For example, in many jurisdictions where a person signs a contract under duress, that contract is treated as being void ab initio. The frequent combination "null and void" is a legal doublet.
5	Legal_terminology	Violent disorder	130	Violent disorder is a statutory offence in England and Wales. It is created by section 2(1) of the Public Order Act 1986. Sections 2(1) to (4) of that Act provide:(1) Where 3 or more persons who are present together use or threaten unlawful violence and the conduct of them is such as would cause a person of reasonable firmness present at the scene to fear for their personal safety, each of the persons using or threatening unlawful violence is guilty of violent disorder.(2) It is immaterial whether the 3 or more use or threaten unlawful violence simultaneously.(3) No person of reasonable firmness need actually be, or be likely to be, present at the scene.(4) Violent disorder may be committed in private as well as in public places.
6	Legal_terminology	Verdict	63	In law, a verdict is the formal finding of fact made by a jury on matters or questions submitted to the jury by a judge. In a bench trial, the judge's decision near the end of the trial is simply referred to as a finding. In England and Wales, a coroner's findings used to be called verdicts but are, since 2009, called conclusions.
7	Legal_terminology	Valid claim	28	In Law, a valid claim is a "grievance that can be resolved by legal action." It is a claim that is not frivolous, nor is based on fraud.
8	Legal_terminology	Vacant possession	7	Vacant possession is a property law concept.
9	Legal_terminology	Unfair competition	56	Unfair competition in commercial law is a deceptive business practice that causes economic harm to other businesses or to consumers. It includes a number of areas of law involving acts by one competitor or group of competitors which harm another in the field, and which may give rise to criminal offenses and civil causes of action.
10	Legal_terminology	Turbary	68	Turbary is the ancient right to cut turf, or peat, for fuel on a particular area of bog. The word may also be used to describe the associated piece of bog or peatland and, by extension, the material extracted from the turbary. Turbary rights, which are more fully expressed legally as common of turbary, are often associated with commonage, or, in some cases, rights over another person's land.
11	Legal_terminology	Trust instrument	38	A trust instrument is an instrument in writing executed by a settlor used to constitute a trust. Trust instruments are generally only used in relation to an inter vivos trust; testamentary trusts are usually created under a will.
12	Legal_terminology	Tracing (law)	79	Tracing is a legal process, not a remedy, by which a claimant demonstrates what has happened to his/her property, identifies its proceeds and those persons who have handled or received them, and asks the court to award a proprietary remedy in respect of the property, or an asset substituted for the original property or its proceeds. Tracing allows transmission of legal claims from the original assets to either the proceeds of sale of the assets or new substituted assets.
13	Legal_terminology	Title (property)	123	In property law, a title is a bundle of rights in a piece of property in which a party may own either a legal interest or equitable interest. The rights in the bundle may be separated and held by different parties. It may also refer to a formal document, such as a deed, that serves as evidence of ownership. Conveyance of the document may be required in order to transfer ownership in the property to another person. Title is distinct from possession, a right that often accompanies ownership but is not necessarily sufficient to prove it. In many cases, possession and title may each be transferred independently of the other. For real property, land registration and recording provide public notice of ownership information.
14	Legal_terminology	Theftbote	69	Theftbote, a misdemeanour, occurs when a crime victim accepts the return of stolen property or makes other arrangements with a felon in exchange for an agreement not to prosecute. Such private deals were criminalized by Edward III, King of England, because they reduced fines and other forfeitures of property, which were an important part of the royal revenue. Theftbote was one of the first misdemeanour offences to be enacted.
15	Legal_terminology	Testamentary trust	42	A testamentary trust is a trust which arises upon the death of the testator, and which is specified in his or her will. A will may contain more than one testamentary trust, and may address all or any portion of the estate.
16	Legal_terminology	Test case (law)	82	In case law, a test case is a legal action whose purpose is to set a precedent. Test cases are brought to court as a means to provide a clearer definition to laws with disputed meaning and/or intent. An example of a test case might be a legal entity who files a lawsuit to see if the court considers a certain law or a certain legal precedent applicable in specific circumstances. This is useful, for example, to validate later filing similar lawsuits.
17	Legal_terminology	Terms (law)	14	In a legal terminology, Terms can have different meanings, depending on the specific context.
18	Legal_terminology	Tax lien	47	A tax lien is a lien imposed by law upon a property to secure the payment of taxes. A tax lien may be imposed for delinquent taxes owed on real property or personal property, or as a result of failure to pay income taxes or other taxes.
19	Legal_terminology	Tardiness	35	Tardiness is the habit of being late or delaying arrival. Being late as a form of misconduct may be formally punishable in various arrangements, such as workplace, school, etc. An opposite personality trait is punctuality.
20	Legal_terminology	Tangible property	26	Tangible property in law is, literally, anything which can be touched, and includes both real property and personal property, and stands in distinction to intangible property.
21	Legal_terminology	Tangibility	25	According to the philosopher Piyush Mathur (2017), "Tangibility is the property that a phenomenon exhibits if it has and/or transports mass and/or energy and/or momentum". 
22	Legal_terminology	Tacit relocation	61	Tacit Relocation in Scots Law is a principle whereby leases of land or buildings are renewed on the same conditions as previously existed if no notice of termination is given within the requisite period, subject to a minimum period of one year, applying in perpetuity until such notice is given. The concept is also known in the law of South Africa.
23	Legal_terminology	Surrogate decision-maker	91	A surrogate decision maker, also known as a health care proxy or as agents, is an advocate for incompetent patients. If a patient is unable to make decisions for themselves about personal care, some agent must make decisions for them. If there is a durable power of attorney for health care, the agent appointed by that document is authorized to make health care decisions within the scope of authority granted by the document. If people have court-appointed guardians with authority to make health care decisions, the guardian is the authorized surrogate.
24	Legal_terminology	Surrebuttal	28	In an adversarial process, for instance a court proceeding, a surrebuttal is a response to the opposing party's rebuttal; in essence it is a rebuttal to a rebuttal.
25	Legal_terminology	Surplusage	120	In jurisprudence, surplusage is a useless statement completely irrelevant to the cause. Surplusages may be included in any declaration, plea, or claim. According to LectLawif a man in his declaration, plea, etc., make mention of a thing which need, not be stated, but the matter set forth is grammatically right, and perfectly sensible, no advantage can be taken on demurrer. When, by an unnecessary allegation the plaintiff shows he has no cause of action, the defendant may demur. When the surplusage is not grammatically set right, or it is unintelligible and, no sense at all can be given it, or it be contradictory or repugnant to what is before alleged, the adversary may take advantage of it on special demurrer.
26	Legal_terminology	Surety	100	In finance, a surety, surety bond or guaranty involves a promise by one party to assume responsibility for the debt obligation of a borrower if that borrower defaults. Usually, a surety bond or surety is a promise by a surety or guarantor to pay one party a certain amount if a second party fails to meet some obligation, such as fulfilling the terms of a contract. The surety bond protects the obligee against losses resulting from the principal's failure to meet the obligation. The person or company providing the promise is also known as a "surety" or as a "guarantor".
27	Legal_terminology	Summons	20	A summons is a legal document issued by a court or by an administrative agency of government for various purposes.
28	Legal_terminology	Summary order	53	In law, a summary order is a determination made by a court without issuing a legal opinion. This disposition is also known as a nonopinion, summary opinion, affirmance without opinion, unpublished order, disposition without opinion, or abbreviated disposition. It is not to be confused with summary judgment, which means a decision without trial.
29	Legal_terminology	Summary (law)	744	Summary, in law, forms many compounds as an adjective meaning "short, concise":Summary abatement, the abatement of a nuisance without judicial proceeding, even without notice or hearing, often by a destruction of the offending thing or structure. 39 Am J1st Nuis § 183 et seq.Summary contempt proceeding, a proceeding to adjudicate contempt in the immediate presence of the court, without pleading, affidavit, or formal charges—albeit the accused may be entitled to a hearing or at least opportunity to make an explanation of his conduct under oath. 17 Am J2d Contpt §§ 86-88.Summary conviction, convicting an accused without giving him the benefit of a jury trial and/or indictment.summary court-martial, the lowest in the rank of courts-martial, conducted before one commissioned officer, limited in jurisdiction to offenses of a minor or petty nature of which enlisted men, not commissioned officers, stand accused.Summary dismissal, a dismissal of a civil service employee without giving him opportunity to defend himself or a hearing of any kind. Anno: 131 ALR 396.Summary forfeiture, a forfeiture to the state of property without giving the owner opportunity to be heard. Anno: 17 ALR 574.Summary execution, an execution in which a person is accused of a crime and then immediately killed without benefit of a full and fair trial.Summary judgmentA judgment in a summary proceeding, as one rendered pursuant to statute against the sureties on a bond furnished in an action. 50 Am J1st Suret § 209. A judgment in certain actions specified in the statute providing the remedy, rendered upon plaintiff's motion, usually with supporting affidavits, upon the failure of the defendant to controvert the motion by filing an affidavit of defense or his failure to file an affidavit of defense or affidavit of merits sufficient to show the existence of a genuine issue of fact. 41 Am J1st Pl § 340.A motion for summary judgment is not a trial; on the contrary it assumes that scrutiny of the facts will disclose that the issues presented by the pleadings need not be tried because they are so patently insubstantial as not to be genuine issues at all. Consequently, as soon as it appears upon such a motion that there is really something to "try," the judge must at once deny it and let the cause take its course in the usual way. Cohen v Eleven West 42nd Street 115 F2d 531.Summary jurisdiction, a jurisdiction exercised by summary proceedings, as in a bankruptcy court. 9 Am J2d Bankr § 68.Summary jury trial, an alternative dispute resolution technique, increasingly being used in civil disputes in the United StatesSummary offence, a crime in some common law jurisdictions that can be proceeded against summarily, without the right to a jury trial and/or indictment. Typically minor or petty offenses.Summary order, a decision without an opinion explaining the decision.Summary possessory proceeding, a proceeding, summary in character, to which a landlord may resort for the recovery or possession of leased premises when he becomes entitled to possession. 32 Am J1st L & T § 1016.Summary proceeding.A proceeding by which a controversy is settled, case disposed of, or trial conducted in a prompt, simple manner without the aid of a jury and without observance of requirements which prevail in a plenary action in reference to commencement of action, service of papers, etc. Western & A. R. Co. v Atlanta, 113 Ga 537, 38 SE 996. A proceeding in the Bankruptcy Court upon petition and answer at a day set for hearing upon notice or order to show cause against the relief proposed. 9 Am J2d Bankr § 69. A proceeding before an administrative body, requiring notice and hearing, but not requiring a full compliance with the rules governing trials of civil actions. Emerson v Hughes, 117 Vt 270, 90 A2d 910, 34 ALR2d 539.Summary proceedings are not conducted without proper investigation of the facts, or without notice, or an opportunity to be heard by the person alleged to have committed the acts, or whose property is sought to be affected. The term summary proceedings is also applied to proceedings which are taken lawfully, but without resort to the courts, such as the physical abatement of a nuisance, or the recaption of goods. Western & Atlantic Railroad Co. v Atlanta, 113 Ga 537, 38 SE 996.Summary trial, a trial of a person on a criminal charge, without a jury. A trial in a summary proceeding.
30	Legal_terminology	Sum certain	67	A sum certain is a specified and set amount of money owed by one person to another. It is a legal term of art, having specialized meaning in the law. Some kinds of legal claims can not be brought at all unless the sum certain can be plead. A document claimed to be a negotiable instrument can not be negotiated unless it is for a sum certain.
31	Legal_terminology	Suggestion of death	43	A suggestion of death, in law, refers to calling the death of a party to the attention of a court and making it a matter of record, as a step in the revival of an action abated by the death of a party.
32	Legal_terminology	Stuffed article	63	Stuffed article is a legal or industry term describing items such as mattresses, beds, upholstery, pillows, plush toys, teddy bears etc., i.e.: fabric items stuffed with an inert, resilient material, such as cotton, kapok, or polyurethane foam. Such articles sold as new in the United States usually are required to have a tag called a law label describing the fabric and stuffing used.
33	Legal_terminology	Strike from the record	62	To strike from the record is for a judge to forbid a decision maker to consider a particular piece of testimony or other evidence when deciding the case even though he or she has already learned what that evidence or testimony concerned. The commonly heard request is "move to strike", with the intent to erase previous testimony or court proceeding from record.
34	Legal_terminology	Strategic lawsuit against public participation	54	A strategic lawsuit against public participation (SLAPP) is a lawsuit that is intended to censor, intimidate, and silence critics by burdening them with the cost of a legal defense until they abandon their criticism or opposition. Such lawsuits have been made illegal in many jurisdictions on the grounds that they impede freedom of speech.
35	Legal_terminology	Stranger in blood	37	In the law of United States and the Commonwealth, a stranger in blood is someone mentioned in a will who is not related by blood to the testator. It is therefore the opposite of next of kin.
36	Legal_terminology	Stipulation	23	In United States law, a stipulation is a formal legal acknowledgment and agreement made between opposing parties before a pending hearing or trial.
37	Legal_terminology	Stakeholder (law)	129	Being in escrow is a contractual arrangement in which a third party receives and disburses money or property for the primary transacting parties, most generally, used with plentiful terms that conduct the rightful actions that follow. The disbursement is dependent on conditions agreed to by the transacting parties. Examples include an account established by a broker for holding funds on behalf of the broker's principal or some other person until the consummation or termination of a transaction; or, a trust account held in the borrower's name to pay obligations such as property taxes and insurance premiums. The word derives from the Old French word escroue, meaning a scrap of paper or a scroll of parchment; this indicated the deed that a third party held until a transaction was completed.
38	Legal_terminology	Special meaning	21	Special meaning when used formally refers to the fixed or restricted interpretation of certain words or phrases allowed in certain matters.
39	Legal_terminology	Spamigation	60	Spamigation is mass litigation conducted to intimidate large numbers of people. The term was coined by Brad Templeton of the Electronic Frontier Foundation to explain the tactics of the Recording Industry Association of America (RIAA), which files large numbers of lawsuits against individuals for file sharing, and DirecTV, which once filed large numbers of lawsuits against users of smart cards.
40	Legal_terminology	Short cause	52	If the parties to a case anticipate that it will not take up a significant amount of time, they may apply for the court to designate it as a short cause. Cases on the "short cause" calendar will get priority since they will not tie up a courtroom for a long time.
41	Legal_terminology	Shocks the conscience	38	Shocks the conscience is a phrase used as a legal standard in the United States and Canada. An action is understood to "shock the conscience" if it is perceived as manifestly and grossly unjust, typically by a judge.
42	Legal_terminology	Shifting burden of persuasion	64	The shifting burden of persuasion is the process of transferring the obligation to prove a fact in an issue raised during a lawsuit from one party to the other party. When the party initially bearing the burden of proof has presented sufficient evidence to support its claim then it becomes the responsibility of the other party to issue a rebuttal that provides defensive evidence.
43	Legal_terminology	Sheriff-substitute	103	In the Courts of Scotland, a sheriff-substitute was the historical name for the judges who sit in the local sheriff courts under the direction of the sheriffs principal; from 1971 the sheriffs substitute were renamed simply as sheriff. When researching the history of the sheriffs and sheriffs principal of Scotland there is much confusion over the use of different names to refer to sheriffs in Scotland. Sheriffs principal are those sheriffs who have held office over a sheriffdom, whether through inheritance or through direct appointment by the Crown. Thus, hereditary sheriff and sheriff-depute are the precursors to the modern office of sheriff principal.
44	Legal_terminology	Sharp practice	29	Sharp practice or sharp dealing is a pejorative phrase to describe sneaky or cunning behavior that is technically within the rules of the law but borders on being unethical.
45	Legal_terminology	Shareholders' agreement	108	A shareholders' agreement (SHA) is an agreement amongst the shareholders or members of a company. In practical effect, it is analogous to a partnership agreement. It can be said that some jurisdictions fail to give a proper definition to the concept of shareholders' agreement, however particular consequences of this agreements are defined so far. There are advantages of the shareholder's agreement; to be specific, it helps the corporate entity to maintain the absence of publicity and keep the confidentiality. Nonetheless, there are also some disadvantages that should be considered, such as the limited effect to the third parties and alternation of the stipulated articles can be time consuming.
46	Legal_terminology	Sex characteristics (legal term)	80	In law, sex characteristics refers to an attribute defined for the purposes of protecting individuals from discrimination due to their sexual features. The attribute of sex characteristics was first defined in national law in Malta, in 2015. The legal term has since been adopted by United Nations, European, and Asia-Pacific institutions, and in a 2017 update to the Yogyakarta Principles on the application of international human rights law in relation to sexual orientation, gender identity, gender expression and sex characteristics.
47	Legal_terminology	Settlor	121	In law a settlor is a person who settles property on trust law for the benefit of beneficiaries. In some legal systems, a settlor is also referred to as a trustor, or occasionally, a grantor or donor. Where the trust is a testamentary trust, the settlor is usually referred to as the testator. The settlor may also be the trustee of the trust or a third party may be the trustee. In the common law of England and Wales, it has been held, controversially, that where a trustee declares an intention to transfer trust property to a trust of which he is one of several trustees, that is a valid settlement notwithstanding the property is not vested in the other trustees.
48	Legal_terminology	Set-off (law)	106	In law, set-off or netting are legal techniques applied between persons with mutual rights and liabilities, replacing gross positions with net positions. It permits the rights to be used to discharge the liabilities where cross claims exist between a plaintiff and a respondent. The result being that the gross claims of mutual debt produces a single, net claim. The net claim is known as a net position. In other words, a set-off is the right of a debtor to balance mutual debts with a creditor. In bookkeeping terms, set-offs are also known as reconciliations. To determine a set-off, simply subtract the smaller debt from the larger.
49	Legal_terminology	Sequestration (law)	30	In law, sequestration is the act of removing, separating, or seizing anything from the possession of its owner under process of law for the benefit of creditors or the state.
50	Legal_terminology	Self-help (law)	64	Self-help, in the sense of a legal doctrine, refers to individuals' implementation of their rights without resorting to legal writ or consultation of higher authority, as where a financial institution repossesses a car on which they hold both the title and a defaulted note. Individuals resort to self-help when they retrieve property found under the unauthorized control of another person, or simply abate nuisances.
51	Legal_terminology	Security of payment	59	Security of Payment refers to any system designed to ensure that contractors and sub-contractors are paid even in case of dispute. This can involve a system of progress payments, interim arbitration decisions, or a system which legally requires a company to pay an invoice within a set number of days, regardless of whether the company believes they are accurate.
52	Legal_terminology	Second lien loan	26	The vast majority of all second lien loans are senior secured obligations of the borrower. Second lien loans differ from both unsecured debt and subordinated debt.
53	Legal_terminology	Seat (legal entity)	94	In legal English, the seat of a corporation or organisation, as a legal entity, is the location of its headquarters. According to international and national procedural law, "specific legal actions with legal effect for and against the legal entity can be performed at the seat of this entity." However, "the term 'seat' is sometimes also used in a broad sense without a specific legal meaning. In this case [it] only defines where an entity is located and does not mean that this location is a legal seat where specific juridical acts can be performed."
